question,answer,input_tokens,output_tokens,total_tokens,response_time_seconds,p99_processing_time,p95_processing_time,avg_processing_time,page_count,avg_time_per_page,p99_time_per_page,p95_time_per_page,tokens_per_page
"Where can additional information be found about SSA offices, particularly for Puerto Rico?","Additional information is available on the Social Security Office Locator page at secure.ssa.gov/ICON, where you can enter your ZIP code to locate the nearest SSA office in Puerto Rico.",,,,,,,,,,,,
"How should an employer handle the SSN section on Form W-2 when an employee has applied for an SSN but does not yet have one, and what steps are taken once the SSN is received?","If filing on paper, the employer should enter “Applied For” in the SSN field; if filing electronically, all zeros (000-00-0000 or 000000000) should be entered. When the employee receives the SSN, the employer must file Copy A of Form W-2c with the SSA and provide Copies B, C, and 2 to the employee.",,,,,,,,,,,,
What should an employer do if an employee’s name on Form W-2 does not match the name on their Social Security card due to events like marriage or divorce?,"The employer should advise the employee to obtain an updated Social Security card from SSA, record wages under the old name until the updated card is provided, and ensure the name and SSN on the record match what’s shown on the employee’s Social Security card.",,,,,,,,,,,,
What action must be taken if the SSA issues an updated social security card after a name change or a new card with a different SSN due to a change in alien work status?,The employer must file Form W-2c to correct the name or SSN reported on the most recently filed Form W-2 without the need to correct previous years’ records.,,,,,,,,,,,,
What is the guidance regarding the use of IRS individual taxpayer identification numbers (ITINs) in place of Social Security numbers (SSNs)?,The text instructs that an ITIN should not be accepted in place of an SSN.,,,,,,,,,,,,
What is the purpose of an ITIN and who is eligible to receive one?,An ITIN is used solely for tax identification purposes and is available only to resident and nonresident aliens who are not eligible for U.S. employment.,,,,,,,,,,,,
How can you identify an ITIN based on its format?,"An ITIN is a nine-digit number, formatted like an SSN, that starts with ""9"" and has its fourth and fifth digits within the ranges “50–65,” “70–88,” “90–92,” or “94–99.”",,,,,,,,,,,,
What should an individual with an ITIN do if they later become eligible to work in the United States?,"They must obtain an SSN by applying for one, following the specific instructions provided for applying for an SSN.",,,,,,,,,,,,
"How should one apply for an SSN, and what should not be used in place of it on Form W-2?","One should apply for an SSN by following the instructions listed under ""Applying for an SSN,"" and an ITIN should not be used in place of an SSN on Form W-2.",,,,,,,,,,,,
What is the Social Security Number Verification Service (SSNVS) and how can it be used by employers or authorized reporting agents?,"The SSNVS is a service that allows employers and authorized reporting agents to instantly verify that an employee’s name matches their SSN; it can handle up to 10 names and SSNs per screen or accept an electronic file of up to 250,000 names and SSNs, with results typically provided by the next business day.",,,,,,,,,,,,
How can employers confirm the employment eligibility of newly hired employees and what is needed to access the SSNVS?,"Employers can confirm employment eligibility using E-Verify available at E-Verify.gov, while accessing the SSNVS requires that the user have a Social Security online account, which can be either a personal my Social Security account (created before September 18, 2021) or credentials from Login.gov or ID.me.",,,,,,,,,,,,
"What credentials might you need to create according to the text, and where can you find more information?","You may need to create a Social Security online account, a Login.gov credential, or an ID.me credential; more information is available at SSA.gov/bso.",,,,,,,,,,,,
What types of compensation are considered wages subject to federal employment taxes?,"Wages include all pay given to an employee for services performed, such as salaries, vacation allowances, bonuses, commissions, and taxable fringe benefits, regardless of how the payments are measured or made.",,,,,,,,,,,,
Are payments like signing bonuses and compensation for canceled employment contracts considered wages for tax purposes?,"Yes, both bonuses for signing or ratifying a contract and compensation paid for canceling an employment contract—as well as payments to a former employee for services performed while employed—are considered wages subject to Social Security, Medicare, FUTA taxes, and income tax withholding.",,,,,,,,,,,,
What taxes are generally applicable to employees performing farmwork according to the text?,"They are generally subject to social security tax and Medicare tax, and if the wages are subject to these taxes, they’re also subject to federal income tax withholding. Additionally, additional Medicare tax may need to be withheld, deposited, and reported.",,,,,,,,,,,,
What is the employer’s responsibility if less than the correct tax is withheld from an employee’s wages?,"The employer is liable for the full amount of the tax due to the federal government, even if they withhold less than the correct tax amount from an employee's wages.",,,,,,,,,,,,
Which additional wage topics and resources does the text reference for further information?,"The text refers to section 9 for additional Medicare tax information, section 14 for FUTA tax details, section 6 for a discussion of tips, section 7 for supplemental wages, section 15 for exceptions to general wage rules, Pub. 15-A for nonqualified deferred compensation and other compensation, and Pub. 15-B for other forms of compensation, including accident-related compensation.",,,,,,,,,,,,
What types of compensation does Pub. 15-B address?,"Pub. 15-B discusses various forms of compensation including accident and health benefits, achievement awards, adoption assistance, athletic facilities, de minimis benefits, dependent care assistance, educational assistance, employee discounts, employee stock options, employer-provided cell phones, group-term life insurance coverage, health savings accounts, lodging on business premises, meals, no-additional-cost services, retirement planning services, transportation (commuting) benefits, tuition reduction, and working condition benefits.",,,,,,,,,,,,
What items are considered noncash wages for farmworkers?,"Noncash wages for farmworkers include items such as food, lodging, clothing, transportation passes, farm products, or other goods or commodities.",,,,,,,,,,,,
How are noncash wages treated as cash wages managed for tax purposes and reporting?,"When noncash wages are treated as cash wages because the transaction’s substance is a cash payment, they become subject to social security taxes, Medicare taxes, and federal income tax withholding, and their value must be reported in box 1 of Form W-2 (or box 7 of Form 499R-2/W-2PR) along with cash wages.",,,,,,,,,,,,
How should noncash wages for farmwork be reported on Form W-2?,"Noncash wages for farmwork should be shown in box 1 of Form W-2, together with cash wages, but they should not be shown in boxes 3 or 5 unless specific conditions are met.",,,,,,,,,,,,
Under what circumstances are noncash wages for farmwork subject to federal income tax?,Noncash wages for farmwork are subject to federal income tax unless a specific exclusion applies.,,,,,,,,,,,,
How are share farmers treated in terms of withholding Social Security and Medicare taxes?,"You do not have to withhold or pay Social Security and Medicare taxes on amounts paid to share farmers under share-farming arrangements because a share farmer is not considered an employee, although they may be subject to self-employment tax.",,,,,,,,,,,,
How should compensation of $600 or more paid to H‑2A workers be reported on Form W‑2?,It should be reported in box 1 (or box 7 on Form 499R‑2/W‑2PR) without reporting it as social security wages (boxes 3 or 20) or Medicare wages (boxes 5 or 22).,,,,,,,,,,,,
Why is compensation paid to H‑2A workers for agricultural labor not reported as social security or Medicare wages?,Because such compensation is not subject to social security and Medicare taxes.,,,,,,,,,,,,
"Under what condition may an employer withhold federal income tax from an H‑2A worker’s compensation, and how should it be reported?","Although withholding is not required, an employer may withhold federal income tax if the worker requests it by providing a completed Form W‑4, and the tax withheld should then be reported in box 2 of Form W‑2.",,,,,,,,,,,,
How should federal income tax withholding be reported for H‑2A workers who provide their TIN to the employer?,"For H‑2A workers who provide their TIN, federal income tax withheld should be reported in box 2 of Form W‑2.",,,,,,,,,,,,
What actions must an employer take if an H‑2A worker does not provide a TIN and has annual wages of at least $600?,"If an H‑2A worker does not provide a TIN and their total annual wages are at least $600, the employer is required to backup withhold according to the specified IRS instructions.",,,,,,,,,,,,
"How should employee business expense reimbursements be reported, and what determines the reporting method?","Employee business expense reimbursements should be reported based on whether there is an accountable or nonaccountable plan; if a single payment includes both wages and an expense reimbursement, the specific amount of the reimbursement must be separately specified.",,,,,,,,,,,,
What are the three rules that an employee must meet under a reimbursement or allowance arrangement?,"The employee must (1) have paid or incurred allowable expenses while performing services (with the reimbursement or advance being for expenses, not wages), (2) substantiate these expenses within a reasonable period, and (3) return any amounts in excess of substantiated expenses within a reasonable period.",,,,,,,,,,,,
What happens if an employee does not substantiate expenses or does not return excess amounts within a reasonable period?,"If the expenses are not substantiated or excess amounts are not returned within a reasonable period, the amount paid over the substantiated expenses is treated as paid under a nonaccountable plan and becomes subject to income, social security, Medicare, and FUTA taxes in the first payroll period following the end of the reasonable period.",,,,,,,,,,,,
How are amounts paid under an accountable plan treated for tax purposes?,"Amounts paid under an accountable plan are not considered wages and are not subject to income, social security, Medicare, and FUTA taxes, as long as the employee substantiates the expenses and returns any excess amounts within a reasonable time.",,,,,,,,,,,,
"What constitutes a ""reasonable period of time"" for advances, expense accounting, and returning excess amounts?","It is considered reasonable if employees receive their advance within 30 days after incurring expenses, account for those expenses within 60 days, and return any excess amounts within 120 days; alternatively, providing a periodic statement (at least quarterly) that requires employees to return or account for outstanding amounts within 120 days is also acceptable.",,,,,,,,,,,,
How are payments made under a nonaccountable plan treated for tax purposes?,"Payments made under a nonaccountable plan are treated as wages, specifically as supplemental wages, and are subject to income, Social Security, Medicare, and FUTA taxes.",,,,,,,,,,,,
Under what conditions are expenses considered to be paid under a nonaccountable plan?,"Expenses are deemed paid under a nonaccountable plan if the employee is not required to provide receipts or documentation to substantiate the expenses in a timely manner, or if the employee does not return any advanced amounts for business expenses in a timely fashion.",,,,,,,,,,,,
Under what conditions might a payment for business expenses be treated as wages according to the text?,"A payment may be treated as wages if you provide an advance for business expenses that the employee is not required to return (or does not return promptly), if you pay an amount regardless of whether the employee incurs business expenses, or if you reimburse an amount that would otherwise have been paid as wages.",,,,,,,,,,,,
How does the text explain the reimbursement of employees using per diem or other fixed allowances?,"The text states that employers may reimburse employees based on travel days, miles, or another fixed allowance under the applicable revenue procedure, and the employee is considered to have accounted for the reimbursement as long as it does not exceed the rates established by the federal government.",,,,,,,,,,,,
Where can employers find the federal government established rates for auto expenses and for meals and lodging?,"The standard mileage rate for auto expenses is provided in Publication 15-B, and the government per diem rates for meals and lodging in the continental United States can be found in Publication 15 (2025), specifically mentioned on page 19.",,,,,,,,,,,,
What must be done with the “rule above” that appears on proofs including departmental reproduction proofs?,It must be removed before printing.,,,,,,,,,,,,
Where can one find the official per diem rates mentioned in the text?,The rates are available on the U.S. General Services Administration website at GSA.gov/PerDiemRates.,,,,,,,,,,,,
What happens if the per diem or allowance paid to an employee exceeds the substantiated amount?,"If the per diem exceeds the substantiated amount, the excess must be reported as wages subject to income tax withholding as well as social security, Medicare, and FUTA taxes. The substantiated (nontaxable) portion should be shown in box 12 of Form W-2 using code “L” (or no code for employers in Puerto Rico).",,,,,,,,,,,,
What are payments in kind and what is their general tax treatment?,"Payments in kind refer to noncash compensation provided in the form of goods, lodging, food, clothing, or services. Generally, the fair market value of these payments at the time they’re provided is subject to federal income tax withholding as well as Social Security, Medicare, and FUTA taxes.",,,,,,,,,,,,
What exceptions exist for the taxation of noncash payments for certain types of work?,"Noncash payments for household work, agricultural labor, and services not performed in the employer’s trade or business are exempt from Social Security, Medicare, and FUTA taxes. Income tax withholding on these payments will only occur if both the employer and the employee agree to it. Additionally, noncash payments for agricultural labor—like commodity wages—are treated as cash payments subject to employment taxes when the transaction’s substance is essentially a cash payment.",,,,,,,,,,,,
How are meals and lodging provided by an employer taxed?,"The value of meals is not treated as taxable income and is exempt from federal income tax withholding and employment taxes if the meals are furnished for the employer's convenience and on the employer's premises. Similarly, lodging provided under these conditions is not subject to federal income tax withholding, Social Security, Medicare, or FUTA taxes.",,,,,,,,,,,,
"Under what conditions is lodging not subject to federal income tax withholding, social security, Medicare, and FUTA taxes?","Lodging is not subject to these taxes if it is furnished on the employer’s premises, provided for the employer’s convenience, and offered as a condition of employment.",,,,,,,,,,,,
What does the term “for the convenience of the employer” mean in the context of providing meals and lodging?,"It means that there must be a substantial business reason—other than extra compensation—for offering meals or lodging, such as ensuring employees are available during emergencies (e.g., being on-site during a lunch period), and this must be supported by evidence that such emergency calls have occurred or can reasonably be expected.",,,,,,,,,,,,
What does the 50% test refer to regarding the provision of meals?,"The 50% test states that if more than half of the employees provided meals on the employer's business premises receive them for the employer's convenience, then all meals provided under those circumstances are considered to be for the employer’s convenience.",,,,,,,,,,,,
What is the tax treatment of meals provided on an employer’s business premises if the 50% test is met?,"If at least 50% of the meals provided on an employer’s business premises are furnished for the employer’s convenience, the value of those meals is excludable from employee income and is not subject to federal income tax withholding or employment taxes.",,,,,,,,,,,,
How are employer-paid accident or health insurance plans treated for tax purposes?,"Employer payments for accident or health insurance plans (including coverage for an employee’s spouse and dependents) are not considered wages and therefore are not subject to social security, Medicare, FUTA taxes, or federal income tax withholding. This exclusion generally also applies to qualified long-term-care insurance contracts.",,,,,,,,,,,,
What special tax consideration is given to health insurance benefits for S corporation employees who are more than 2% shareholders?,"For S corporation employees owning more than 2%, the value of health insurance benefits must be included in their wages for income tax withholding purposes, but these benefits are excluded from wages when calculating social security, Medicare, and FUTA taxes.",,,,,,,,,,,,
What determines whether an employer's contributions to an employee’s HSA or Archer MSA are subject to taxes?,"If it is reasonable to believe at the time of payment that the contributions will be excludable from the employee’s income, they aren’t subject to social security, Medicare, FUTA tax, or federal income tax withholding; if not, they are subject to these taxes.",,,,,,,,,,,,
How do employee contributions to their HSAs or MSAs differ when made through a payroll deduction plan versus a salary reduction arrangement in a Section 125 cafeteria plan?,"Contributions made through a payroll deduction plan must be included in wages and are subject to social security, Medicare, FUTA taxes, and federal income tax withholding, whereas contributions made under a salary reduction arrangement in a Section 125 cafeteria plan aren’t considered wages and aren’t subject to employment taxes or withholding.",,,,,,,,,,,,
What is the tax treatment of medical care reimbursements paid under an employer’s self-insured medical reimbursement plan?,"These medical care reimbursements generally aren’t treated as wages and aren’t subject to social security, Medicare, FUTA taxes, or federal income tax withholding.",,,,,,,,,,,,
What is the tax treatment of self-insured medical reimbursement plans according to the text?,"Self-insured medical reimbursement plans are not considered wages and are not subject to social security, Medicare, or FUTA taxes, nor are they subject to federal income tax withholding.",,,,,,,,,,,,
"What are differential wage payments, and how are they treated for tax purposes?","Differential wage payments are payments made to an individual by an employer for a period during which the individual is on active duty in the uniformed services for more than 30 days, representing all or a portion of the wages the individual would have received if performing services for the employer. They are treated as wages for income tax withholding but are not subject to social security, Medicare, or FUTA taxes.",,,,,,,,,,,,
"Where should differential wage payments be reported on tax forms, as mentioned in the text?",Differential wage payments should be reported in box 1 of Form W-2 (or box 7 of Form 499R-2/W-2PR).,,,,,,,,,,,,
What is the general rule for including fringe benefits in an employee’s wages?,"You must generally include fringe benefits in the employee’s wages, and these benefits are subject to income tax withholding and employment taxes. The taxable amount is generally the FMV of the benefit minus the sum of what the employee paid and any amount excluded by law.",,,,,,,,,,,,
Where can you find more information about the tax treatment of differential wage payments?,"More information about the tax treatment of differential wage payments is available in Revenue Ruling 2009‑11, 2009‑18 I.R.B. 896, which can be found at IRS.gov/irb/2009-18_IRB#RR-2009-11.",,,,,,,,,,,,
What does the text indicate about nontaxable fringe benefits and give an example?,"The text states that some fringe benefits are nontaxable (or minimally taxable) if certain conditions are met, with details available in Pub. 15‑B. One example provided is services offered to employees at no additional cost.",,,,,,,,,,,,
What are some examples of nontaxable fringe benefits mentioned in the text?,"Examples include services provided to employees at no extra cost, qualified employee discounts, working condition fringes (like a company car for business use or business magazine subscriptions), certain minimal value fringes (such as an occasional cab ride or meals provided at a company-operated eating place), qualified transportation fringes (covering commuter vehicles, transit passes, and qualified parking), the use of on-premises athletic facilities (primarily for employees and their families), qualified tuition reduction, and employer-provided cell phones used primarily for noncompensatory business reasons.",,,,,,,,,,,,
How are working condition fringes defined as nontaxable in the text?,Working condition fringes are defined as property or services that would be allowable as a business expense or depreciation expense deduction to the employee if the employee had paid for them. The text provides examples such as a company car for business use and subscriptions to business magazines.,,,,,,,,,,,,
What specific conditions apply to qualified transportation fringe benefits as described in the text?,"Qualified transportation fringes are provided subject to specified conditions and dollar limitations. They include transportation in a commuter highway vehicle, any transit pass, and qualified parking.",,,,,,,,,,,,
Which fringe benefits must be included in the wages of highly compensated employees unless they are available nondiscriminatorily to other employees?,"No-additional-cost services, qualified employee discounts, meals provided at an employer-operated eating facility, and reduced tuition for education.",,,,,,,,,,,,
How can employers treat the payment timing of taxable noncash fringe benefits?,"Employers may designate these benefits as paid by the pay period, by the quarter, or on any other basis as long as they are treated as paid at least once a year, with all benefits provided in a calendar year treated as paid by December 31.",,,,,,,,,,,,
Do employers need to make a formal choice of payment dates or notify the IRS when designating the payment basis for taxable fringe benefits?,"No, employers do not need to make a formal choice or notify the IRS, and this method does not have to be chosen for all employees uniformly.",,,,,,,,,,,,
When must the value of fringe benefits be determined?,The value of fringe benefits must be determined no later than January 31 of the next year.,,,,,,,,,,,,
What options does an employer have for withholding federal income tax on fringe benefits?,An employer can either add the value of fringe benefits to regular wages and figure withholding taxes on the total or withhold federal income tax on the value at the optional flat 22% supplemental wage rate (with additional guidance if supplemental wages exceed $1 million during the calendar year).,,,,,,,,,,,,
What tax withholding is required on an employee's personal use of a company-provided vehicle?,"While an employer may choose not to withhold income tax on the personal use of a vehicle, social security and Medicare taxes must be withheld on that use.",,,,,,,,,,,,
How should the value of fringe benefits be treated when calculating social security and Medicare taxes?,"The value of fringe benefits must be added to the regular wages for the payroll period, and the taxes are figured on this total amount.",,,,,,,,,,,,
"What option does an employer have if they withhold less than the required amount of social security and Medicare taxes from an employee, but report and pay the proper amount?",The employer may recover the difference from the employee if they withhold less than the required amount during a calendar year.,,,,,,,,,,,,
What are the requirements regarding the deposit of taxes on fringe benefits and handling any overestimations?,"Once the payment timing for fringe benefits is chosen, taxes must be deposited in the same deposit period; moreover, if by January 31 the value of a fringe benefit was overestimated at withholding and deposit time, the employer may claim a refund or apply the overpayment to the next employment tax return.",,,,,,,,,,,,
What penalty might you face if you underestimated the value of fringe benefits and deposited too little?,"You may be subject to a failure-to-deposit (FTD) penalty, as noted in section 11.",,,,,,,,,,,,
How can an employer recover taxes if the deposited amount was correct but the employee withholding was less than required?,"The employer can recover the social security, Medicare, or income taxes deposited on the employee's behalf (as shown on the employee’s Form W‑2), with the income taxes needing to be recovered before April 1 of the following year.",,,,,,,,,,,,
