question,answer,input_tokens,output_tokens,total_tokens,response_time_seconds,p99_processing_time,p95_processing_time,avg_processing_time,page_count,avg_time_per_page,p99_time_per_page,p95_time_per_page,tokens_per_page
What is the procedure for reporting adjustments if the actual tax withheld is less or more than the calculated amount?,"If the actual amount withheld is less, a negative adjustment should be reported (using a minus sign or parentheses if needed), and if the actual amount is more, a positive adjustment should be reported.",,,,,,,,,,,,
Which forms and lines should be used to report the employer and employee shares of social security and Medicare taxes on third‐party sick pay?,"They should be reported on Form 941, lines 5a and 5c; alternatively, on Form 943, lines 2 and 4, or Form 944, lines 4a and 4c.",,,,,,,,,,,,
When and how is the Additional Medicare Tax reported for sick pay?,"If an employee’s aggregate wages from both the employer and third‐party payer exceed $200,000 for the calendar year, the Additional Medicare Tax is reported on Form 941, line 5d; alternatively, on Form 943, line 7, or Form 944, line 4d.",,,,,,,,,,,,
"How should the tax on tips be adjusted if there are insufficient employee funds, and what must still be reported?","If by the 10th of the month following the receipt of an employee’s tip report there are not enough employee funds to withhold their share of social security and Medicare taxes, you no longer have to collect it; however, you must still report the entire amount of these tips on Form 941, lines 5b and 5c.",,,,,,,,,,,,
Which forms and lines must be used to report the entire amount of tips?,"Report the entire amount of tips on Form 941, lines 5b and 5c, or on Form 944, lines 4b and 4c.",,,,,,,,,,,,
"What should be done if an employee’s aggregate wages and tips exceed $200,000 in a calendar year?","If the aggregate wages and tips exceed $200,000, report the Additional Medicare Tax on Form 941, line 5d (or Form 944, line 4d) and include the total uncollected employee share of social security and Medicare taxes as a negative adjustment on Form 941, line 9 (or Form 944, line 6).",,,,,,,,,,,,
How are social security and Medicare taxes related to group-term life insurance premiums for former employees handled?,"The employee share of social security and Medicare taxes for group-term life insurance premiums over $50,000 for a former employee is paid by the former employee on their tax return and not collected by the employer; however, all social security and Medicare taxes for such coverage must be included on Form 941, lines 5a and 5c (or Form 944, lines 4a and 4c).",,,,,,,,,,,,
"On Form 943, where must the social security wages, Medicare wages, social security tax, and Medicare tax be reported?","Social security wages are reported on line 2, Medicare wages on line 4, the social security tax on line 3, and the Medicare tax on line 5 of Form 943.",,,,,,,,,,,,
"What steps should be taken if an employee’s group-term life insurance premiums combined with other wages exceed $200,000 in a calendar year?","If the amount exceeds $200,000, the Additional Medicare Tax must be reported—on Form 941 (line 5d) or Form 944 (line 4d), and on Form 943, wages for it are included on line 6 with the tax reported on line 7. Additionally, the employee share of these taxes should be backed out as a negative adjustment on Form 941 (line 9), Form 943 (line 10), or Form 944 (line 6).",,,,,,,,,,,,
What documentation is required for the adjustments described and how should it be handled with the related forms?,"A brief supporting statement must be prepared and retained to explain the nature and amount of each adjustment, but it should not be attached to Form 941, Form 943, or Form 944.",,,,,,,,,,,,
"What adjustment does Cedar, Inc. need to report for fractions of cents on Form 941?","Cedar, Inc. must report a positive $1.44 fractions-of-cents adjustment on Form 941, line 7 because the amounts withheld and deposited were $1.44 more than the employee share due to adding or dropping fractions of cents per wage payment.",,,,,,,,,,,,
"Why is Cedar, Inc. entitled to a sick pay adjustment on Form 941, and what is the amount?","Cedar, Inc. is entitled to a negative $1,000 sick pay adjustment because, although it included $2,000 in taxes for sick pay, the third-party payer had already withheld and paid the employee share of $1,000.",,,,,,,,,,,,
Which forms provide instructions for reporting the uncollected employee share of social security and Medicare taxes on tips and group-term life insurance?,The General Instructions for Forms W-2 and W-3 provide the guidance on how to report the uncollected employee share of social security and Medicare taxes on tips and group-term life insurance.,,,,,,,,,,,,
"What sick pay adjustment does Cedar, Inc. report on Form 941?","Cedar, Inc. is entitled to a $1,000 negative sick pay adjustment on Form 941, line 8.",,,,,,,,,,,,
"How is Cedar, Inc.'s group-term life insurance premium adjustment calculated for former employees?","For group-term life insurance premiums in excess of $50,000, Cedar, Inc. must include the employee share of social security and Medicare taxes of $200, resulting in a negative $200 adjustment on Form 941, line 9.",,,,,,,,,,,,
"Should any changes be made to the federal tax liability record reported on Form 941, line 16 (or the corresponding lines on other forms) due to these adjustments?","No; the amounts reported reflect the actual taxes withheld from employees' wages, so no changes should be made to the record of federal tax liability.",,,,,,,,,,,,
"What effect do the current period adjustments have on the amounts reported on Forms 941, 943, and 944?","The adjustments ensure that the amounts reported—specifically on Form 941, lines 5a–5d (column 2), Form 943 (lines 3, 5, and 7), or Form 944 (lines 4a–4d, column 2)—equal the actual amounts withheld, so no additional changes to the federal tax liability record are necessary.",,,,,,,,,,,,
Which forms should be used for making corrections to previously filed employment tax returns?,"To correct errors on previously filed returns, use Form 941-X, Form 943-X, or Form 944-X; additionally, Form 945-X and Form CT-1 X are used to report corrections on the corresponding returns.",,,,,,,,,,,,
Where can one find examples and additional details regarding interest-free adjustments and claims for refund?,"Examples and further information are provided in Revenue Ruling 2009-39 (and Revenue Ruling 2009-52 I.R.B. 951), and Revenue Ruling 2009-39 is available at IRS.gov/irb/2009-52_IRB#RR-2009-39.",,,,,,,,,,,,
What change did Treasury Decision 9405 bring about regarding employment taxes?,"It changed the process for making interest-free adjustments to employment taxes reported on Forms 941, 943, and 944, and for filing a claim for a refund of employment taxes.",,,,,,,,,,,,
Under what circumstances should the adjustment process be used according to the text?,"The adjustment process should be used if employment taxes were underreported and a payment is being made, or if employment taxes were overreported and the credit is being applied to the Form 941, 943, or 944 period when filing Form 941-X, 943-X, or 944-X.",,,,,,,,,,,,
When is the claim process appropriate as described in the text?,The claim process should be used when employment taxes have been overreported and a refund or abatement of the overreported amount is being requested.,,,,,,,,,,,,
"How should you correct an error found on a previously filed Form 941, Form 943, or Form 944?","You must correct the error using the corresponding Form 941-X, Form 943-X, or Form 944-X, and file a separate correction form for each original form you are correcting, filing them separately from the original forms.",,,,,,,,,,,,
"What are the reporting requirements for current quarter adjustments for fractions of cents, third‐party sick pay, tips, and group‐term life insurance?","Report these adjustments on Form 941 using lines 7–9, on Form 943 using line 10, and on Form 944 using line 6.",,,,,,,,,,,,
How should you report corrections for both underreported and overreported amounts for the same tax period when requesting a refund?,"If requesting a refund, file one correction form (Form 941-X, Form 943-X, or Form 944-X) correcting the underreported amounts only, and file a second correction form for the overreported amounts.",,,,,,,,,,,,
Which forms are used to correct underreported and overreported amounts as mentioned in the text?,"Form 944‑X is used for correcting underreported amounts only, while a second Form 941‑X, Form 943‑X, or Form 944‑X is used for correcting overreported amounts.",,,,,,,,,,,,
What resource does the text mention for choosing between the adjustment process and the claim process?,"The text refers to a chart on the last page of Form 941‑X, Form 943‑X, or Form 944‑X for help in choosing whether to use the adjustment process or the claim process.",,,,,,,,,,,,
How should current calendar year income tax withholding errors be corrected according to the text?,"Income tax withholding errors should be corrected on Form 941‑X when the error is discovered during the same calendar year in which the wages were paid, ensuring only errors from that year are adjusted.",,,,,,,,,,,,
What is the purpose of the amount shown on an employee's Form W‑2 (or W‑2c) as mentioned in the text?,The amount shown on Form W‑2 or W‑2c is used by the employee as a credit when filing their income tax return (such as Form 1040).,,,,,,,,,,,,
Under what circumstances can you adjust amounts reported as income tax withheld in a previous calendar year?,You can adjust previously reported income tax withheld only to correct an administrative error or if section 3509 applies.,,,,,,,,,,,,
How is an administrative error defined in the context of income tax withholding adjustments?,"An administrative error occurs when the amount reported on Forms 941, 943, or 944 does not match the amount actually withheld from employees—often due to mathematical or transposition errors—requiring correction to align with what is reported on employees’ Forms W‑2.",,,,,,,,,,,,
What types of adjustments to Additional Medicare Tax withholding errors can be made during the same calendar year?,"You can adjust Additional Medicare Tax withholding errors discovered during the same calendar year in which wages were paid, but you cannot adjust amounts from a prior calendar year unless it is to correct an administrative error or if section 3509 applies.",,,,,,,,,,,,
Under what conditions can a claim for a refund be filed for an overpayment of Additional Medicare Tax?,"A claim for refund cannot be filed for an overpayment unless the amount wasn’t actually withheld from the employee's wages, which would be considered an administrative error.",,,,,,,,,,,,
How should underwithheld income tax and Additional Medicare Tax be handled with respect to later pay?,"If you withheld less than the correct amount from an employee's wages, you can make up the difference from later pay, but the underwithheld income tax and Additional Medicare Tax must be recovered from the employee on or before the last day of the calendar year, with reimbursement being a matter for settlement between you and the employee.",,,,,,,,,,,,
When must any excess income tax or Additional Medicare Tax withheld from an employee be repaid or reimbursed?,Any excess income tax or Additional Medicare Tax withholding must be repaid or reimbursed to the employee before the end of the calendar year in which it was withheld.,,,,,,,,,,,,
What documentation should be kept in the employer's records regarding repayments or reimbursements to employees?,The employer should keep the employee's written receipt showing the date and amount of the repayment or a record of the reimbursement.,,,,,,,,,,,,
Which forms need to be filed when making adjustments to correct wages and social security and Medicare taxes for a previous year?,"When adjustments are made to correct wages and related taxes, Form W-2c and Form W-3c must be filed.",,,,,,,,,,,,
"What forms must be filed with the SSA for correcting totals reported for a previous year, and how many Forms W‑2c can be submitted per online session?","You must file Form W‑2c and Form W‑3c with the SSA, and up to 25 Forms W‑2c may be filed per Form W‑3c in a single online session.",,,,,,,,,,,,
Under what circumstances is a correction not eligible for interest‑free treatment of employment taxes?,A correction won’t be eligible for interest‑free treatment if the failure to report relates to an issue raised during an IRS examination of a prior return or if the employer knowingly underreported its employment tax liability.,,,,,,,,,,,,
When does a correction become ineligible for interest‑free treatment based on IRS actions?,A correction becomes ineligible for interest‑free treatment once the employer receives either an IRS notice and demand for payment after assessment or an IRS notice of determination under section 7436.,,,,,,,,,,,,
How should repayments that are received for wages paid during a prior quarter in the current year be handled?,"When you receive repayments for wages paid during a prior quarter in the current year, you must report adjustments on Form 941-X to recover income tax withholding as well as social security and Medicare taxes for the repaid wages.",,,,,,,,,,,,
What is the procedure for handling repayments for wages paid in a prior year?,"For repayments received for wages paid in a prior year, you must report an adjustment on Form 941-X, Form 943-X, or Form 944-X to recover social security and Medicare taxes; however, you cannot adjust income tax withholding or Additional Medicare Tax withholding. In addition, you must file Forms W-2c and W-3c with the SSA to correct social security and Medicare wages and taxes.",,,,,,,,,,,,
When is it inappropriate to offset repayments against current year wages?,Offsetting repayments against current year wages is inappropriate unless the repayments are specifically for amounts received in error in the current year.,,,,,,,,,,,,
What steps should employers take when correcting errors on social security and Medicare wages using Form W‑2c?,"Employers must file Form W‑3c with the SSA to correct social security and Medicare wages and taxes, should not correct wages in box 1 on Form W‑2c for the amount paid in error, and must provide a copy of Form W‑2c to the employee.",,,,,,,,,,,,
"How are wages paid in error treated for an employee’s tax reporting, and what actions can the employee take regarding income tax and Additional Medicare Tax?","The wages paid in error remain taxable in the prior year because the employee received and used the funds. The employee cannot file an amended return (Form 1040‑X) to recover the income tax on these wages but may be entitled to a deduction or credit for the repaid wages on the year of repayment. However, the employee should file Form 1040‑X to recover any Additional Medicare Tax paid on these wages.",,,,,,,,,,,,
"Where can an employee find more information on reporting their wage repayment, and what does the text mention about FUTA tax?","Employees can refer to “Repayments in Pub. 525, Taxable and Nontaxable Income” for more information on reporting wage repayments. Additionally, the text notes that FUTA tax does not apply to employers in American Samoa, Guam, and the (incomplete list provided).",,,,,,,,,,,,
Which regions are exempt from paying the FUTA tax and which are not?,"FUTA tax does not apply to employers in American Samoa, Guam, and the CNMI, but it does apply to employers in the USVI and Puerto Rico.",,,,,,,,,,,,
Who is responsible for paying the FUTA tax?,Only the employer pays the FUTA tax—it is not withheld from the employee's wages.,,,,,,,,,,,,
What is the primary purpose of the FUTA tax?,"The FUTA tax, together with state unemployment systems, provides unemployment compensation to workers who have lost their jobs.",,,,,,,,,,,,
What conditions make an employer subject to FUTA tax under the General test for non-farmworker and non-household employees?,"An employer is subject to FUTA tax in 2025 if they either paid wages of $1,500 or more in any calendar quarter in 2024 or 2025, or had one or more employees working at least part of a day in 20 or more different weeks during 2024 or 2025.",,,,,,,,,,,,
How is the FUTA tax liability determined for household employees?,"An employer will be subject to FUTA tax in 2025 if they paid total cash wages of $1,000 or more to household employees in any calendar quarter in 2024 or 2025. A household employee is defined as someone who performs household work in a private home, local college club, or local fraternity or sorority chapter.",,,,,,,,,,,,
What is the threshold for FUTA tax liability when it comes to farmworkers?,"An employer is subject to FUTA tax in 2025 on wages paid to farmworkers if they paid cash wages of $20,000 or more in any calendar quarter in 2024 or 2025.",,,,,,,,,,,,
What are the two tests that determine whether a farm operator’s wages to farmworkers trigger FUTA tax considerations for 2024 or 2025?,"The two tests are: (a) paying cash wages of $20,000 or more to farmworkers during any calendar quarter in 2024 or 2025, or (b) employing 10 or more farmworkers for at least some part of a day on 20 or more different weeks in 2024 or 2025.",,,,,,,,,,,,
How should wages paid to H‑2A visa workers be handled when determining if either test is met?,"Wages paid to H‑2A visa workers—temporary alien farmworkers—must be counted in determining whether either test is met, even though these wages are not subject to the FUTA tax.",,,,,,,,,,,,
How are farmworkers supplied by crew leaders generally classified for FUTA tax purposes?,They are generally considered employees of the farm operator for FUTA tax purposes unless the crew leader is registered under the Migrant and Seasonal Agricultural Worker Protection Act or meets another qualifying exception.,,,,,,,,,,,,
Under what conditions are farmworkers generally considered to be employees of the crew leader?,"They are considered employees if (a) the crew leader is registered under the Migrant and Seasonal Agricultural Worker Protection Act, or (b) substantially all of the workers supplied by the crew leader operate or maintain tractors, harvesting or crop-dusting machines, or other machines provided by the crew leader.",,,,,,,,,,,,
What is the FUTA tax rate for 2025 and to what wage amount does it apply?,"The FUTA tax rate for 2025 is 6.0%, and it applies to the first $7,000 paid to each employee as wages during the year.",,,,,,,,,,,,
"How can state unemployment tax credits affect the FUTA tax rate, and what are the conditions for receiving the maximum credit?","You can take a credit against your FUTA tax for amounts paid into state unemployment funds, which may reduce the FUTA tax rate by up to 5.4%—resulting in a rate of 0.6% if the maximum credit is received. To get the maximum credit, you must have paid your state unemployment taxes in full, on time, and on all wages subject to FUTA tax, and the state must not be designated as a credit reduction state.",,,,,,,,,,,,
What happens when certain wages that are subject to FUTA tax are excluded from state unemployment tax?,"In states where certain wages (such as wages paid to corporate officers, certain sick pay payments by unions, and certain fringe benefits) are excluded from state unemployment tax even though they are subject to FUTA tax, you may be required to deposit more than 0.6% FUTA tax on those wages.",,,,,,,,,,,,
How should liabilities for credit reduction be handled in credit reduction states under FUTA tax rules?,"In years when there are credit reduction states, you must include liabilities owed for credit reduction with your fourth quarter deposit. You may deposit the anticipated extra liability throughout the year, but it isn’t due until the due date for the fourth quarter deposit, and the corresponding liability should be recorded as incurred in the fourth quarter.",,,,,,,,,,,,
Where can you find further guidance on determining FUTA tax credit and the related deposit requirements?,"The Instructions for Form 940 provide guidance on determining the credit, handling wages excluded from state unemployment tax, and managing credit reduction liabilities, so you should refer to them for further information.",,,,,,,,,,,,
What does the text say about the treatment of wages from a business acquired from an employer already liable for FUTA tax?,"If you acquire a business from an employer who was liable for FUTA tax, you may be able to count the wages that employer paid to the employees who continue working for you when figuring the $7,000 FUTA tax wage base.",,,,,,,,,,,,
How should FUTA tax liability be calculated on a quarterly basis according to the text?,"FUTA tax liability should be determined by multiplying the amount of taxable wages paid during the quarter by 0.6%, with potential adjustments depending on your entitlement to the credit for state unemployment contributions.",,,,,,,,,,,,
What are the deposit requirements for FUTA tax as described in the text?,"You must stop depositing FUTA tax for an employee once their taxable wages reach $7,000 for the calendar year; if your FUTA tax liability for any calendar quarter is over $500 (including any tax carried forward), you must make a deposit, but if it is $500 or less, you may carry it forward and add it to the next quarter's liability.",,,,,,,,,,,,
What deposit method is required if your FUTA tax liability (including any carried forward amount) for a calendar quarter exceeds $500?,You must deposit the tax by EFT if your FUTA liability for a calendar quarter is over $500 (including any FUTA tax carried forward from an earlier quarter).,,,,,,,,,,,,
"When is the FUTA tax deposit due for each quarter, and what happens if the due date falls on a weekend or legal holiday?","The FUTA tax is due by the last day of the first month following the end of the quarter, and if this due date falls on a Saturday, Sunday, or legal holiday, you may make your deposit on the next business day.",,,,,,,,,,,,
What is the requirement for depositing FUTA taxes for household employees?,"You are not required to deposit FUTA taxes for household employees unless you report their wages on Forms 941, 943, or 944.",,,,,,,,,,,,
What is the filing deadline for the 2024 Form 940 and how does timely depositing FUTA taxes affect this deadline?,"You must file your 2024 Form 940 by January 31, 2025; however, if you deposited all FUTA taxes when due, you may file on or before February 10, 2025.",,,,,,,,,,,,
What payment options are available when electronically filing Form 940?,"When filing Form 940 electronically, you can pay the balance due using a credit or debit card or by using Electronic Funds Withdrawal (EFW). More information is available at IRS.gov/Payments.",,,,,,,,,,,,
"According to the provided table, what are the deadlines for depositing FUTA taxes for each quarterly period?","Deposits for FUTA taxes are due as follows: for the quarter ending January–February–March, deposit by March 31; for the quarter ending April–May–June, deposit by June 30; for the quarter ending July–August–September, deposit by September 30; and for the quarter ending October–November–December, deposit by December 31.",,,,,,,,,,,,
What is required to file Schedule H (Form 1040) according to the text?,"You must have an EIN to file Schedule H (Form 1040), and additional information can be found in Publication 926.",,,,,,,,,,,,
Who can file Forms 940 electronically for groups of taxpayers and where is more information provided?,"Reporting agents filing Forms 940 for groups of taxpayers can file them electronically, with additional details provided in section 12.",,,,,,,,,,,,
What are the electronic filing requirements for CPEOs and how can they request a waiver if needed?,"CPEOs are required to electronically file Form 940 with Schedule R (Form 940). If a CPEO is unable to file electronically, they may request a waiver by submitting a written request through the IRS Online Registration System for Professional Employer Organizations at least 45 days before the return’s due date, with more information available at IRS.gov/CPEO and in Revenue Procedure 2023-18.",,,,,,,,,,,,
What instruction is provided regarding the printing of the rule on proofs?,"The text states that the type and rule prints on all proofs, including departmental reproduction proofs, and it must be removed before printing.",,,,,,,,,,,,
To which legal code are the section references made in the document?,The section references are made to the Internal Revenue Code unless otherwise noted.,,,,,,,,,,,,
Under what conditions is agricultural labor considered taxable under the employment taxes outlined in the text?,"For agricultural labor, services on a farm (such as cultivating soil, raising or harvesting commodities, and caring for animals) or services performed for a farm owner/operator are taxable if the wages are subject to Social Security and Medicare taxes, if the $150 test or $2,500 test in section 9 is met, or if either test in section 14 is met.",,,,,,,,,,,,
What are the general criteria outlined in the text for wages to be considered taxable?,"Wages are deemed taxable if they are subject to social security and Medicare taxes, if they meet the $150 test or the $2,500 test specified in section 9, or if they meet either of the tests described in section 14.",,,,,,,,,,,,
