question,answer,input_tokens,output_tokens,total_tokens,response_time_seconds,p99_processing_time,p95_processing_time,avg_processing_time,page_count,avg_time_per_page,p99_time_per_page,p95_time_per_page,tokens_per_page
Which publication is referenced in the text and for what year is it intended?,"The text references Publication 15 (Circular E), Employer's Tax Guide, which is intended for use in 2025.",,,,,,,,,,,,
Where does the text indicate that forms and additional tax information can be obtained?,"The text indicates that forms and additional information can be accessed faster at IRS.gov and its language-specific sites: IRS.gov/Spanish, IRS.gov/Chinese, IRS.gov/Korean, IRS.gov/Russian, and IRS.gov/Vietnamese.",,,,,,,,,,,,
What range of topics does the table of contents in the guide cover?,"The table of contents covers topics such as the Employer Identification Number (EIN), who are employees, family employees, the employee's Social Security Number (SSN), wages and other compensation, tips, supplemental wages, payroll period, withholding from employees' wages, required notice about the Earned Income Credit (EIC), depositing taxes, filing various forms (941, 943, 944, or 945), and reporting adjustments.",,,,,,,,,,,,
What sections are listed in the table of contents of the text excerpt?,"The sections include Reporting Adjustments to Forms 941, Form 943, or Form 944; Federal Unemployment (FUTA) Tax; Special Rules for Various Types of Services and Payments; Third-Party Payer Arrangements; and Federal Agency Certifying Requirements of Federal Income Taxes Withheld from U.S. Government Employees Working in, or Federal Pension Recipients Residing in, American Samoa, the CNMI, and Guam.",,,,,,,,,,,,
What information does the text provide regarding social security and Medicare taxes for 2025?,"The text states that for 2025, the rate of social security tax on taxable wages is 6.2% for both the employer and employee, with a social security wage base limit of $176,100, and the Medicare tax rate is 1.45% each for the employee and employer, unchanged from 2024.",,,,,,,,,,,,
Where can one find the latest updates and future developments related to Pub. 15?,"The text directs readers to visit IRS.gov/Pub15 for the latest information about developments related to Pub. 15, including any new legislation enacted after its publication.",,,,,,,,,,,,
"What is the Medicare tax rate for employees and employers, and is there a wage base limit for Medicare tax?","The Medicare tax rate is 1.45% for each the employee and employer, and there is no wage base limit for Medicare tax.",,,,,,,,,,,,
What cash wage thresholds trigger the application of Social Security and Medicare taxes for household workers and election workers in 2025?,"Social Security and Medicare taxes apply to household workers paid $2,800 or more in cash wages and to election workers paid $2,400 or more in cash or an equivalent form of compensation in 2025.",,,,,,,,,,,,
"Which amended employment tax return forms can be filed electronically using Modernized e-File (MeF), and which forms currently cannot?","You can file amended Forms 940, 941-X, 943-X, and 945-X electronically using MeF, but Form 944-X and Form CT-1X cannot be filed electronically using MeF at this time.",,,,,,,,,,,,
What is Form CT –1 X used for?,It is the Adjusted Employer's Annual Railroad Retirement Tax Return or Claim for Refund.,,,,,,,,,,,,
"Which publication is now used by all employers, and which publications have been discontinued?","Pub. 15 is now used by all employers (including agricultural employers and those in U.S. territories), and Pub. 51, Pub. 80, and Pub. 179 have been discontinued.",,,,,,,,,,,,
What are the deadlines for claiming the COVID-19 related credit for qualified sick and family leave wages?,"The credit is limited to leave taken after March 31, 2020, and before October 1, 2021, and it may no longer be claimed outside of those dates.",,,,,,,,,,,,
What is the time frame during which leave must have been taken to potentially qualify for the sick and family leave credit?,"The leave must have been taken after March 31, 2020, and before October 1, 2021, with the FFCRA credit applying to leave taken after March 31, 2020 and before April 1, 2021, and the ARP credit applying to leave taken after March 31, 2021 and before October 1, 2021.",,,,,,,,,,,,
Which of the credits for qualified sick and family leave wages mentioned in the text have expired?,"The credit for qualified sick and family leave wages under the FFCRA (for leave taken after March 31, 2020 and before April 1, 2021) and the credit under the ARP (for leave taken after March 31, 2021 and before October 1, 2021) have expired.",,,,,,,,,,,,
"Are employers still eligible to claim the credit for qualified sick and family leave wages in the future, and what change has been made to Form 941?","Yes, employers that pay qualified sick and family leave wages in 2024 or 2025 for leave taken after March 31, 2020 and before October 1, 2021 are eligible to claim the credit; however, for tax periods beginning after December 31, 2023, the lines used to claim the credit have been removed from Form 941.",,,,,,,,,,,,
Which forms no longer include the credit for qualified sick and family leave wages?,"The credit has been removed from Form 941 (Employer’s QUARTERLY Federal Tax Return), Form 943 (Employer’s Annual Tax Return for Agricultural Employees), and Form 944 (Employer’s ANNUAL Federal Tax Return).",,,,,,,,,,,,
What is the recommended procedure for claiming the credit for qualified sick and family leave wages paid in 2024 or 2025?,"If you paid the qualified wages in 2024 or 2025 for an earlier applicable leave period, you should first file the appropriate Form 941, Form 943, or Form 944, and then file the corresponding amended return—Form 941-X, Form 943-X, or Form 944-X—to claim the credit.",,,,,,,,,,,,
Why were these changes made regarding the credit for qualified sick and family leave wages?,"The changes were made because it is extremely rare for an employer to pay wages after December 31, 2023 for qualified sick and family leave taken between March 31, 2020 and October 1, 2021.",,,,,,,,,,,,
Which forms are available in Spanish for filing related employer returns?,"You can file Form 941 (sp), Form 943 (sp), or Form 944 (sp) if you prefer your form and instructions in Spanish.",,,,,,,,,,,,
"What is the maximum payroll tax credit a qualified small business could elect for increasing research activities for tax years beginning before January 1, 2023?","A qualified small business may elect to claim up to $250,000 of its credit for increasing research activities as a payroll tax credit for tax years beginning before January 1, 2023.",,,,,,,,,,,,
How does the Inflation Reduction Act of 2022 affect the payroll tax credit election amount and what forms are used to elect and report this credit?,"For tax years beginning after December 31, 2022, the Inflation Reduction Act of 2022 increases the election amount to $500,000. The election and determination of the credit used against payroll taxes are made on Form 6765, and the amount must then be reported on Form 8974.",,,,,,,,,,,,
Which form is used to report the amount from Form 6765?,"The amount from Form 6765 must be reported on Form 8974, Qualified Small Business Payroll Tax Credit for Increasing Research Activities.",,,,,,,,,,,,
How is the payroll tax credit applied starting in the first quarter of 2023?,"Starting in the first quarter of 2023, the payroll tax credit is first used to reduce the employer share of social security tax up to $250,000 per quarter, then any remaining credit reduces the employer share of Medicare tax for the quarter, and any still remaining credit is carried forward to the next quarter.",,,,,,,,,,,,
Where can additional information about the payroll tax credit and its application on various forms be found?,"More information about the payroll tax credit is available at IRS.gov/ResearchPayrollTC, and further details on applying the credit can be found in the instructions for Form 941 (line 16), Form 943 (line 17), or Form 944 (line 13).",,,,,,,,,,,,
What type of disaster-related assistance does the text mention?,"The text mentions disaster tax relief, which is available for those impacted by disasters, and directs readers to IRS.gov/DisasterTaxRelief for more information.",,,,,,,,,,,,
Which organizations can claim the payroll tax credit and under what condition?,Certain tax-exempt organizations affected by qualified disasters (not related to COVID-19) can claim the payroll tax credit under Section 303(d) of the Taxpayer Certainty and Disaster Tax Relief Act of 2020.,,,,,,,,,,,,
How and when should organizations file for the payroll tax credit?,"The credit is claimed on Form 5884-D, which should be filed after the relevant filing of Form 941 (for the quarter), Form 943 (for the year), or Form 944 (for the year) for which the credit is being claimed.",,,,,,,,,,,,
Where can employers find the withholding tables and instructions for figuring employee withholding for 2025?,"They can be found in Pub. 15-T, Federal Income Tax Withholding Methods, which is available at IRS.gov/Pub15T.",,,,,,,,,,,,
How does P.L. 115-97 affect the tax treatment of qualified moving expense reimbursements for most employees for tax years beginning after 2017 and before 2026?,It suspends the exclusion from taxable income for qualified moving expense reimbursements during those tax years.,,,,,,,,,,,,
"Under what circumstances does the moving expense reimbursement exclusion still apply despite P.L. 115-97, and what conditions must be met?","The exclusion remains available for members of the U.S. Armed Forces on active duty who move because of a permanent change of station due to a military order, and it applies only to reimbursements for moving expenses that the member could have deducted if they had paid or incurred them without reimbursement.",,,,,,,,,,,,
What changes did Public Law 115-97 introduce regarding the withholding rates on supplemental wages for certain tax years?,"P.L. 115-97 lowered the withholding rates on supplemental wages for tax years beginning after 2017 and before 2026, with the specific rates outlined in section 7 of the text.",,,,,,,,,,,,
How did Public Law 115-97 modify the backup withholding rate for the specified tax years?,It lowered the backup withholding rate to 24% for tax years beginning after 2017 and before 2026; additional details on backup withholding can be found later in the text.,,,,,,,,,,,,
What requirements and implications are associated with the certification program for professional employer organizations (PEOs) established under the ABLE Act of 2014?,"The ABLE Act of 2014 mandated the IRS to establish a voluntary certification program for PEOs, whereby certified professional employer organizations (CPEOs) must meet requirements detailed in sections 3511 and 7705 and related guidance. Certification may affect employment tax liabilities, as a CPEO is generally treated as the employer for any individual providing services to its customer under a specific contract described in section 7705(e)(2).",,,,,,,,,,,,
What must an organization do to become a CPEO?,It must apply through the IRS Online Registration System; additional information and the application process are available at IRS.gov/CPEO.,,,,,,,,,,,,
What responsibilities does an employer retain when outsourcing payroll and related tax duties?,"The employer remains responsible for ensuring that tax returns are filed and deposits and payments are made, even if these tasks are contracted out, and is liable if the third-party fails to perform any required actions.",,,,,,,,,,,,
What does the contract described in section 7705(e)(2) between a CPEO and its customer cover?,It covers wages and other compensation paid to the individual by the CPEO.,,,,,,,,,,,,
When is a CPEO treated as the employer for wages and compensation paid to an individual?,"If a CPEO pays wages and other compensation to an individual performing services under a CPEO contract, the CPEO is generally treated as the employer for those wages and compensation.",,,,,,,,,,,,
What additional responsibility might you have regarding federal employment taxes for employees covered by a CPEO contract?,"For certain employees covered by a CPEO contract, you may also be treated as an employer and thus be liable for federal employment taxes imposed on wages and other compensation paid by the CPEO.",,,,,,,,,,,,
What filing requirements apply to approved section 3504 agents and CPEOs when dealing with aggregate Form 941 or Form 943 filers?,"Approved section 3504 agents and CPEOs must complete Schedule R (Form 941) for aggregate quarterly Form 941 filers or Schedule R (Form 943) for aggregate annual Form 943 filers, as applicable, when filing those forms.",,,,,,,,,,,,
What must an agent do to request approval from the IRS to act as an agent for an employer?,"The agent must file Form 2678 with the IRS, except for state or local government agencies that use special procedures provided in Revenue Procedure 2013-39, 2013-52 I.R.B. 830.",,,,,,,,,,,,
What steps and forms are involved in becoming a Certified Professional Employer Organization (CPEO)?,"To become a CPEO, an organization must apply through the IRS Online Registration System at IRS.gov/CPEO; once approved, a CPEO files an aggregate quarterly Form 941 or an annual Form 943 and uses Form 8973 to notify the IRS when they start or end a service contract with a client.",,,,,,,,,,,,
What electronic filing requirements apply to CPEOs and other third-party payers filed for Forms 941 or 943?,"CPEOs, as well as other third-party payers like non-certified PEOs with clients claiming certain credits, must complete and file the applicable Schedule R electronically along with Form 941 or Form 943, with further details available in Revenue Procedure 2023-18.",,,,,,,,,,,,
Which entities are required to complete and file Schedule R as mentioned in the text?,"Non-certified PEOs with clients claiming any employment tax credit, as well as aggregate Form 940 filers—including Approved section 3504 agents and CPEOs—must complete and file the applicable Schedule R.",,,,,,,,,,,,
What is the role of Schedule R (Form 940) in the filing process?,"Schedule R (Form 940) serves as the Allocation Schedule for Aggregate Form 940 Filers, which must be completed when filing the aggregate Form 940, Employer's Annual Federal Unemployment (FUTA) Tax Return.",,,,,,,,,,,,
What are the requirements for an agent acting on behalf of home care service recipients when filing aggregate Forms 940?,"The agent must request approval by filing Form 2678 with the IRS to act on behalf of home care service recipients, unless the agent is a state or local government agency acting under the special procedures provided in Revenue Procedure 2013-39.",,,,,,,,,,,,
What forms do CPEOs file and what are their electronic filing requirements?,"CPEOs approved under IRS section 7705 file Aggregate Forms 940 and use Form 8973 to notify the IRS when they start or end a service contract with a client. They generally file Form 940 and Schedule R (Form 940) electronically, with further electronic requirements detailed in Revenue Procedure 2023-18.",,,,,,,,,,,,
How can qualified tax-exempt organizations claim the work opportunity tax credit for hiring eligible unemployed veterans?,"Qualified tax-exempt organizations may claim the work opportunity tax credit against their payroll tax liability by using Form 5884-C, with additional information available at IRS.gov/WOTC.",,,,,,,,,,,,
How are Medicaid waiver payments treated for federal income tax purposes?,"Certain Medicaid waiver payments are excludable from income for federal income tax purposes, as explained in Notice 2014-7, with further details and a Q&A available at IRS.gov/MedicaidWaiverPayments.",,,,,,,,,,,,
What is the tax treatment for disability payments received due to injuries from a terrorist attack directed against the United States?,"Disability payments for injuries incurred as a direct result of a terrorist attack directed against the United States (or its allies) are not included in income, and therefore no federal income tax should be withheld from these payments.",,,,,,,,,,,,
How can a shareholder of an Alaska Native Corporation request voluntary federal income tax withholding on dividends and other distributions?,A shareholder may request voluntary withholding by submitting a completed Form W-4V to the Alaska Native Corporation.,,,,,,,,,,,,
How is a marriage defined for federal tax purposes according to the provided text?,"A marriage of two individuals is recognized for federal tax purposes if the marriage is recognized by the state or territory of the United States where the marriage is entered into, regardless of legal residence.",,,,,,,,,,,,
Under what conditions are marriages entered into under foreign jurisdiction or American Indian tribe law recognized for federal tax purposes?,"Such marriages are recognized if they would be considered marriages under the laws of at least one state or territory of the United States, regardless of the individuals’ legal residence.",,,,,,,,,,,,
"Are registered domestic partnerships, civil unions, or similar relationships treated as lawful marriages for federal tax purposes?","No, if these relationships are not denominated as a marriage under the law of the state or territory where they were entered into, they are not considered lawful marriages for federal tax purposes.",,,,,,,,,,,,
How do the tax treatments differ between qualified differential wage payments and severance payments?,"Qualified differential wage payments for U.S. Armed Forces members are subject only to income tax withholding, while severance payments are subject to social security, Medicare, income tax withholding, and FUTA taxes, and filing requires written notice from the IRS to use Form 944.",,,,,,,,,,,,
What must an employer do before filing Form 944 instead of quarterly Forms 941?,The employer must receive written notice from the IRS to file Form 944 and must contact the IRS during the first calendar quarter of the tax year to request the change.,,,,,,,,,,,,
Under what condition can an employer request to file Form 944 instead of Forms 941?,"An employer can request to file Form 944 if they have been filing quarterly Forms 941, expect their employment taxes for the calendar year to be $1,000 or less, and desire to switch to the annual filing method.",,,,,,,,,,,,
Where can employers find additional details on how to request to file Form 944 or quarterly Forms 941?,"Employers can refer to the Instructions for Form 944, which outline the methods and deadlines for making the request.",,,,,,,,,,,,
What must an employer do before filing quarterly Forms 941 instead of Form 944?,"An employer must receive a written notice from the IRS instructing them to file quarterly Forms 941 instead of Form 944, and they should refer to the Instructions for Form 944 for more information on making that request.",,,,,,,,,,,,
"How should an error on a previously filed Form 941, Form 943, or Form 944 be corrected?","Any errors on a previously filed Form 941, Form 943, or Form 944 should be corrected using Form 941-X, Form 943-X, or Form 944-X respectively, which are filed separately from the original forms.",,,,,,,,,,,,
"What is the primary use of Forms 941-X, 943-X, and 944-X, and how are they filed in relation to their standard counterparts?","Forms 941-X, 943-X, and 944-X are used by employers to claim refunds or abatements of employment taxes, and they must be filed separately from Forms 941, 943, and 944.",,,,,,,,,,,,
"Which employers must continue to file Form 940 and Forms 941, Form 943, or Form 944 even when no wages are paid?","Employers who file a “final” Form 941, Form 943, or Form 944—or those that aren’t “seasonal” employers (for Form 941 only)—must continue to file Form 940 and the respective quarterly or annual forms even for periods during which no wages are paid.",,,,,,,,,,,,
What method does the IRS encourage for filing “zero wage” payroll tax forms?,"The IRS encourages filing “zero wage” Form 940 and Forms 941, Form 943, or Form 944 electronically, with more information available at IRS.gov/EmploymentEfile.",,,,,,,,,,,,
"How must federal tax deposits be made, and what options are available for making these deposits electronically?","Federal tax deposits must be made by electronic funds transfer (EFT). This is generally done using the Electronic Federal Tax Payment System (EFTPS), but taxpayers may also arrange for their tax professional, financial institution, payroll service, or another trusted third party to make electronic deposits, or have their financial institution initiate a same-day wire payment.",,,,,,,,,,,,
"What service does EFTPS provide, and is there a fee for using it?","EFTPS is a free service provided by the Department of the Treasury that can initiate same-day wire payments on your behalf, although services provided by a tax professional, financial institution, payroll service, or other third party may have a fee.",,,,,,,,,,,,
How can individuals get more information about EFTPS or enroll in the service?,"For more information about EFTPS or to enroll, visit EFTPS.gov or call 800-555-4477 (with 800-244-4829 available for Spanish and 303-967-5916 for toll calls); additional details can also be found in Pub. 966.",,,,,,,,,,,,
What requirement is mentioned for employers regarding residents of the Philippines working in the CNMI?,"Employers must withhold and pay social security and Medicare taxes on wages and other compensation paid to residents of the Philippines working in the CNMI who do not hold an H‑2 status for services performed as employees, unless those workers qualify for an exemption from social security.",,,,,,,,,,,,
Under what circumstances are employees in the CNMI subject to Social Security and Medicare taxes?,"Employees performing services in the CNMI are subject to Social Security and Medicare taxes unless they are eligible for an exemption under an exception listed in section 15, with more details available in Announcement 2012-43, 2012-51 I.R.B. 723.",,,,,,,,,,,,
What tax withholding requirement applies to federal employers in the CNMI according to the 2006 agreement?,"Federal employers, including the Department of Defense, are required to withhold CNMI income taxes (instead of federal income taxes) and deposit these taxes with the CNMI Treasury for employees whose regular place of federal employment is in the CNMI.",,,,,,,,,,,,
What additional information and guidance is provided by Publication 5146?,"Publication 5146 explains employment tax examinations and appeal rights, providing employers with information on how these processes work.",,,,,,,,,,,,
What information does Pub. 5146 provide regarding employment tax examinations?,"Pub. 5146 explains the process of employment tax examinations, including how the IRS selects employment tax returns, what occurs during an exam, and the options an employer has in responding to the exam results, such as the appeal process. It also covers worker classification issues and tip examinations.",,,,,,,,,,,,
What benefits do electronic filing and payment offer to businesses?,"Electronic filing and payment offer businesses convenient and secure methods to file and pay their federal taxes, allowing them to save time and spend more time running their business. These methods are accessible whether businesses use a tax professional or handle taxes themselves.",,,,,,,,,,,,
Where can businesses find more information and access resources for electronic filing and payment?,"For electronic filing (e-file), additional information can be found at IRS.gov/EmploymentEfile, though a fee may be charged. For Electronic Federal Tax Payment System (EFTPS), businesses can visit EFTPS.gov or call the provided customer service numbers, with special dialing instructions available for those who are deaf, hard of hearing, or have a speech disability.",,,,,,,,,,,,
How do you access TRS assistance for disability?,"For disability, dial 711 and then provide the TRS assistant with either the 800-555-4477 number or the 800-733-4829 number.",,,,,,,,,,,,
"Where can employers electronically file Forms W-2 and related wage and tax statement forms, and what should they do if they experience filing problems?","Employers can electronically file these forms by visiting SSA.gov/employer. If filing problems occur, they should contact the SSA at 800-772-6270.",,,,,,,,,,,,
What instructions are provided for employers in the CNMI regarding Form W-2CM?,"Employers in the CNMI should contact their local tax department for instructions on completing Form W-2CM, or they can obtain the form and its instructions by visiting Finance.gov.mp/forms.php or by calling 670-664-1000.",,,,,,,,,,,,
What happens if a valid EIN is not provided when filing a return or making a payment?,"Without a valid EIN, the return or payment will not be processed, and this may result in penalties.",,,,,,,,,,,,
How does Electronic Funds Withdrawal (EFW) work for filing and paying employment taxes?,"If you file your employment tax return electronically, you can use EFW to both file the return and pay the balance due in one step using tax preparation software or a tax professional, but it should not be used for making federal tax deposits.",,,,,,,,,,,,
What should you consider when using a credit or debit card to pay your employment tax balance?,"When paying with a credit or debit card, your payment is processed by a payment processor who charges a processing fee, and these cards should not be used for making federal tax deposits.",,,,,,,,,,,,
What must be done with reproduction proofs before printing?,They must be removed before printing.,,,,,,,,,,,,
