question,answer,input_tokens,output_tokens,total_tokens,response_time_seconds,p99_processing_time,p95_processing_time,avg_processing_time,page_count,avg_time_per_page,p99_time_per_page,p95_time_per_page,tokens_per_page
What should you avoid using on forms that ask for an EIN?,You should avoid using your SSN or individual taxpayer identification number (ITIN) on forms that ask for an EIN.,,,,,,,,,,,,
"What should you do if the EIN on Form 941, Form 943, or Form 944 differs from the EIN on Form W-3?","If the EIN used on Form 941, Form 943, or Form 944 differs from the EIN reported on Form W-3, you should refer to ""Box h — Other EIN used this year"" in the General Instructions for Forms W-2 and W-3. For Form W-3 (PR) for Puerto Rico, this information is reported in box f.",,,,,,,,,,,,
Why is it important for the EIN on Form 945 to match the EIN on your information returns?,"The EIN on Form 945 must match the EIN on your information returns where federal income tax withholding is reported (e.g., backup withholding reported on Form 1099-NEC) to avoid penalties and delays in processing your return.",,,,,,,,,,,,
What information must agricultural employers record about crew leaders?,"Agricultural employers must record the crew leader's name, address, and EIN.",,,,,,,,,,,,
How is employee status determined under common law?,"Under common law, a worker is considered an employee if the employer has the right to control what will be done and how it will be done, even if the worker has some freedom of action.",,,,,,,,,,,,
Are individuals in independent trades generally considered employees?,"No, individuals in independent trades like doctors, lawyers, and veterinarians, who offer their services to the public, are generally not considered employees.",,,,,,,,,,,,
Are corporate officers who work in an incorporated business considered employees?,"Yes, corporate officers who work in an incorporated business are considered employees of the corporation.",,,,,,,,,,,,
How is an employee classified as a statutory employee for Social Security and Medicare tax purposes?,"A person is considered a statutory employee for Social Security and Medicare tax purposes if specific conditions under the ""Tests"" are met for roles such as an agent or commission driver, a full-time life insurance salesperson, a homeworker, or a traveling or city salesperson.",,,,,,,,,,,,
Does the method of payment or work hours affect whether someone is considered an employee?,"No, it does not matter how payments are measured or paid, what they are called, or whether the employee works full or part time.",,,,,,,,,,,,
What are some examples of statutory employees mentioned in the text?,"Examples include an agent or commission driver delivering specific goods, a full-time life insurance salesperson primarily working for one company, a homeworker working under specific guidelines, and a traveling or city salesperson working full time for one firm.",,,,,,,,,,,,
What conditions must be met for statutory employees to have social security and Medicare taxes withheld from their wages?,"Social security and Medicare taxes must be withheld from statutory employees' wages if all three of the following tests are met: 1) The service contract states or implies that almost all services are to be performed personally by them, 2) They have little or no investment in the equipment and property used to perform the services (other than an investment in transportation facilities), and 3) The services are performed on a continuing basis for the same payer.",,,,,,,,,,,,
"Who qualifies as statutory nonemployees, and how are they treated for tax purposes?","Statutory nonemployees include direct sellers, qualified real estate agents, and certain companion sitters. They are generally treated as self-employed for all federal tax purposes, including income and employment taxes.",,,,,,,,,,,,
What types of customers must statutory employees obtain orders from for their services to qualify under the described rules?,"Statutory employees must obtain orders from customers who are retailers, wholesalers, contractors, or operators of hotels, restaurants, or other businesses dealing with food or lodging. The orders must be for merchandise for resale or supplies for use in the customer's business.",,,,,,,,,,,,
How are individuals considered nonemployees treated for federal tax purposes?,"Individuals considered nonemployees are generally treated as self-employed for all federal tax purposes, including income and employment taxes.",,,,,,,,,,,,
Under what conditions are you considered an employer of farmworkers?,"You are considered an employer of farmworkers if your employees: raise or harvest agricultural or horticultural products on your farm; work in connection with the operation, management, conservation, improvement, or maintenance of your farm and its tools and equipment (if the major part of such service is performed on a farm); provide services related to salvaging timber or clearing hurricane debris (hurricane labor) if the major part of such service is performed on a farm; handle, process, or package any agricultural or horticultural commodity in its unmanufactured state if you produced over half of the commodity; or do work related to cotton ginning, turpentine, gum resin products, or irrigation facilities' operation and maintenance.",,,,,,,,,,,,
"What is included in the definition of a ""farm"" for these purposes?","For these purposes, a ""farm"" includes stock, dairy, poultry, fruit, fur-bearing animal, and truck farms.",,,,,,,,,,,,
"What types of agricultural establishments are included in the definition of a ""farm""?","A ""farm"" includes stock, dairy, poultry, fruit, fur-bearing animal, and truck farms, as well as plantations, ranches, nurseries, ranges, greenhouses or other similar structures used primarily for raising agricultural or horticultural commodities, and orchards.",,,,,,,,,,,,
What activities are not considered farmwork under the provided definition?,"Farmwork does not include reselling activities that don't involve substantial raising of agricultural or horticultural commodities, such as a retail store or a greenhouse used primarily for display or storage. It also excludes processing services that change a commodity from its raw or natural state or services performed after the commodity has been changed from its raw or natural state.",,,,,,,,,,,,
What responsibilities define a crew leader as an employer of farmworkers?,"A crew leader is considered an employer of farmworkers if they furnish and pay workers to perform farmwork for the farm operator, either on their own behalf or on behalf of the farm operator, and there is no written agreement stating that the crew leader is an employee of the farm operator.",,,,,,,,,,,,
What determines if someone is considered a crew leader rather than an employee of a farm operator?,"If there is no written agreement stating you are an employee of the farm operator and you pay the workers (either for yourself or for the farm operator), then you are considered a crew leader.",,,,,,,,,,,,
How should H-2A agricultural workers be classified on Form W-2?,"On Form W-2, box 13 (Statutory employee) should not be checked, as H-2A workers are not statutory employees.",,,,,,,,,,,,
What happens if you treat an employee as a nonemployee and fail to withhold required taxes?,"You will generally be liable for social security and Medicare taxes and withheld income tax. You may calculate your liability using special section 3509 rates, but you cannot recover the employee's share of social security tax, Medicare tax, or income tax withholding from the employee.",,,,,,,,,,,,
What is the employer's liability regarding income tax withholding if taxes are paid under Section 3509?,The employer is liable for the income tax withholding regardless of whether the employee paid income tax on the wages.,,,,,,,,,,,,
What are the Section 3509 rates for Social Security and Medicare taxes if the employer issued required information returns?,"For Social Security taxes, the rate is 7.44% of wages (employer rate of 6.2% plus 20% of the employee rate of 6.2%). For Medicare taxes, the rate is the employer rate of 1.45% plus 20% of the employee rate.",,,,,,,,,,,,
When are Section 3509 rates not available to employers?,"Section 3509 rates are not available if the employer intentionally disregarded the requirement to withhold taxes from the employee, withheld income taxes but not Social Security or Medicare taxes, or is reclassifying statutory employees.",,,,,,,,,,,,
What is the total rate of Medicare taxes when including the employer and employee contributions?,"The total rate of Medicare taxes is 1.74% of wages, calculated as the employer rate of 1.45% plus 20% of the employee rate of 1.45%.",,,,,,,,,,,,
What are the section 3509 rates for social security taxes if the employer didn't issue required information returns?,"The section 3509 rates for social security taxes are 8.68% of wages, calculated as the employer rate of 6.2% plus 40% of the employee rate of 6.2%.",,,,,,,,,,,,
How can an employer potentially be relieved from paying employment taxes for a worker?,An employer can be relieved from paying employment taxes for a worker if they have a reasonable basis for not treating the worker as an employee and file all required federal tax forms.,,,,,,,,,,,,
What must an employer do to qualify for relief from paying employment taxes for a worker?,"To qualify for relief, an employer must file all required federal tax returns, including information returns, on a basis consistent with their treatment of the worker. Additionally, the employer (or their predecessor) must not have treated any worker in a substantially similar position as an employee for any periods beginning after 1977.",,,,,,,,,,,,
How can an employer request the IRS to determine whether a worker is an employee?,An employer can request the IRS to determine whether a worker is an employee by filing Form SS-8.,,,,,,,,,,,,
"What is the Voluntary Classification Settlement Program (VCSP), and how can employers apply for it?",The VCSP is a program for employers who currently treat their workers as independent contractors or nonemployees and want to reclassify them as employees for future tax periods. Employers can apply for the VCSP by filing Form 8952. More information is available at IRS.gov/VCSP.,,,,,,,,,,,,
What is the employer's responsibility in a partnership regarding employees?,The partnership is considered the employer of any employees and is liable for any employment taxes due on wages paid to its employees.,,,,,,,,,,,,
"What is a ""qualified joint venture"" and who can participate in it?","A ""qualified joint venture"" is a trade or business where the only members are spouses who file a joint income tax return, both spouses materially participate in the business, and both spouses elect not to be treated as a partnership for federal tax purposes.",,,,,,,,,,,,
What law allows for the election not to be treated as a partnership for qualified joint ventures?,"The Small Business and Work Opportunity Tax Act of 2007 (P.L. 110-28) allows a ""qualified joint venture"" to elect not to be treated as a partnership for federal tax purposes for tax years beginning after 2006.",,,,,,,,,,,,
What are the requirements for a business to qualify as a joint venture between spouses?,The business must be co-owned by both spouses and not held in the name of a state law entity such as a partnership or limited liability company (LLC).,,,,,,,,,,,,
"How should income, gain, loss, deduction, and credit be reported for a qualified joint venture?",These items must be divided between the spouses in accordance with each spouse's interest in the venture and reported as sole proprietors on separate Schedule C (Form 1040) or Schedule F (Form 1040).,,,,,,,,,,,,
Do spouses using the qualified joint venture rules need an EIN for federal tax purposes?,"Spouses using the qualified joint venture rules are treated as sole proprietors for federal tax purposes and generally do not need an EIN. However, if employment taxes are owed, either spouse may use the EIN of their sole proprietorship to report and pay the employment taxes.",,,,,,,,,,,,
What is one benefit of filing as a qualified joint venture for spouses?,Filing as a qualified joint venture gives each spouse credit for social security earnings (which affect retirement benefits) and Medicare coverage without needing to file a partnership return.,,,,,,,,,,,,
How can spouses treat an unincorporated business under community property laws?,"Spouses can treat the business either as a sole proprietorship (of the spouse who carried on the business) or as a partnership, and they may elect to be taxed as a qualified joint venture instead of a partnership.",,,,,,,,,,,,
Where can you find more information about qualified joint ventures?,More information on qualified joint ventures can be found at IRS.gov/QJV.,,,,,,,,,,,,
When are payments to a child under age 18 who works for their parent exempt from Social Security and Medicare taxes?,Payments to a child under age 18 who works for their parent in a trade or business are exempt from Social Security and Medicare taxes if the business is a sole proprietorship or a partnership in which each partner is a parent of the child.,,,,,,,,,,,,
At what age do payments for a child's domestic work in a parent's private home become subject to Social Security and Medicare taxes?,Payments for a child's domestic work in a parent's private home become subject to Social Security and Medicare taxes when the child reaches age 21.,,,,,,,,,,,,
Are payments to a child under age 21 who works for their parent subject to FUTA tax?,"No, payments for the services of a child under age 21 who works for their parent are not subject to FUTA tax.",,,,,,,,,,,,
Are wages for services performed by a spouse in a trade or business subject to social security and Medicare taxes?,"Yes, wages for services of a spouse in a trade or business are subject to income tax withholding, social security, and Medicare taxes, but they are not subject to FUTA tax.",,,,,,,,,,,,
Are wages for services performed by a child or spouse for a corporation subject to withholding and other taxes?,"Yes, wages for services of a child or spouse working for a corporation, even if controlled by the child's parent or spouse, are subject to income tax withholding, social security, Medicare, and FUTA taxes.",,,,,,,,,,,,
"Are payments for domestic services performed by one spouse for another subject to social security, Medicare, and FUTA taxes?","No, payments for domestic services performed by one spouse for another in a private home are not subject to social security, Medicare, and FUTA taxes.",,,,,,,,,,,,
When are payments to a parent employed in their child's trade or business subject to income tax withholding and social security and Medicare taxes?,Payments for the services of a parent in their child’s trade or business are subject to income tax withholding and social security and Medicare taxes.,,,,,,,,,,,,
Under what conditions are payments to a parent for domestic services subject to social security and Medicare taxes?,"Social security and Medicare taxes apply to payments made to a parent for domestic services if the parent is employed by their child, the employer has a child or stepchild living in the home, and the employer is a surviving spouse, divorced and not remarried, or living with a spouse who cannot care for their child or stepchild for at least 4 continuous weeks in the calendar quarter in which the service is performed.",,,,,,,,,,,,
Are payments to a parent for services outside their child's trade or business subject to social security and Medicare taxes?,Payments for the services of a parent not in their child’s trade or business are generally not subject to social security and Medicare taxes.,,,,,,,,,,,,
What is the age or condition requirement for a child or stepchild of an employer to qualify for certain service-related provisions?,"The child or stepchild of the employer must either be under age 18 or, due to a mental or physical condition, require the personal care of an adult for at least 4 continuous weeks in the calendar quarter in which the service is performed.",,,,,,,,,,,,
Are payments made to a parent employed by their child subject to FUTA tax?,"No, payments made to a parent employed by their child aren't subject to FUTA tax, regardless of the type of services provided.",,,,,,,,,,,,
What is required of employers regarding an employee's Social Security Number (SSN)?,"Employers are required to obtain each employee's name and SSN and enter them on Form W-2. The SSN consists of nine digits formatted as 000-00-0000, and this requirement applies to both resident and nonresident alien employees.",,,,,,,,,,,,
What should you do if an employee cannot provide their social security card?,"If an employee can't provide their social security card, you should verify their SSN and their eligibility for employment as discussed under Verification of SSNs.",,,,,,,,,,,,
"Are employers allowed to accept a social security card that says ""Not valid for employment""?","No, employers should not accept a social security card that says ""Not valid for employment,"" as an SSN with this legend does not permit employment.",,,,,,,,,,,,
How can an employee apply for a replacement social security card?,"In many cases, a replacement social security card can be applied for online without visiting an SSA office. In some cases, an SSN application can also be started online before visiting an SSA office. For more information, employees can visit SSA.gov/number-card.",,,,,,,,,,,,
How can someone eligible to work in the U.S. obtain a Social Security card if they don’t have one?,"They can obtain a Social Security card by completing Form SS-5, Application for a Social Security Card, and submitting the necessary documentation.",,,,,,,,,,,,
Where can Form SS-5 be accessed or obtained?,"Form SS-5 can be accessed on the SSA website at SSA.gov/forms/ss-5.pdf, at SSA offices, or by calling 800-772-1213 or 800-325-0778 (TTY).",,,,,,,,,,,,
What are the locations of SSA offices in U.S. territories where Form SS-5 can be filed?,The SSA office locations in U.S. territories are:,,,,,,,,,,,,
Where can you find additional information about Social Security offices in the U.S. Virgin Islands or Puerto Rico?,Additional information is available on the Social Security Office Locator page at secure.ssa.gov/ICON. You can also go to this website and enter your ZIP code to find your nearest SSA office in Puerto Rico.,,,,,,,,,,,,
What should you do on Form W-2 if your employee has applied for an SSN but hasn’t received one by the time you must file?,"If filing Form W-2 on paper, enter ""Applied For"" on the form. If filing electronically, enter all zeros (000-00-0000 if creating forms online or 000000000 if uploading a file) in the SSN field.",,,,,,,,,,,,
How should you handle a corrected SSN after the employee receives it?,"File Copy A of Form W-2c, Corrected Wage and Tax Statement, with the SSA to show the employee's SSN. Also, furnish Copies B, C, and 2 of Form W-2c to the employee.",,,,,,,,,,,,
What should an employee do if their name is incorrect on their social security card due to marriage or divorce?,The employee should request an updated social security card from the SSA and continue to report wages under the old name until they provide the updated card with the corrected name.,,,,,,,,,,,,
When should an employer file Form W-2c after a name or SSN change?,An employer should file Form W-2c to correct the name or SSN reported for the most recently filed Form W-2 after the employee receives an updated social security card with a corrected name or new SSN.,,,,,,,,,,,,
Can an ITIN be used in place of an SSN for reporting purposes?,"No, an ITIN cannot be accepted in place of an SSN.",,,,,,,,,,,,
What is an ITIN and who is eligible to receive one?,"An ITIN is a nine-digit number formatted like an SSN that starts with the number ""9"" and includes specific ranges for the fourth and fifth digits. It is available only to resident and nonresident aliens who are not eligible for U.S. employment and need identification for tax purposes.",,,,,,,,,,,,
Can an ITIN be used in place of an SSN for employee identification or work?,"No, an ITIN cannot be used in place of an SSN for employee identification or work.",,,,,,,,,,,,
What should an individual with an ITIN do if they later become eligible to work in the United States?,"If an individual with an ITIN later becomes eligible to work in the United States, they must obtain an SSN and follow the instructions under ""Applying for an SSN.""",,,,,,,,,,,,
What should employers avoid using in place of an SSN on Form W-2?,Employers should avoid using an ITIN in place of an SSN on Form W-2.,,,,,,,,,,,,
How can employers verify that an employee's name matches their SSN?,"Employers can use the Social Security Number Verification Service (SSNVS) to verify that an employee's name matches their SSN for up to 10 names and SSNs per screen, or they can submit an electronic file with up to 250,000 names and SSNs and usually receive results the next business day.",,,,,,,,,,,,
What credentials are required to access the Social Security Number Verification Service (SSNVS) through the SSA’s BSO?,"To access the SSNVS through the SSA’s BSO, users need a social security online account, which can be a personal my Social Security account created before September 18, 2021, an existing Login.gov credential, or an ID.me credential.",,,,,,,,,,,,
What credentials are needed to access a Social Security online account?,"To access a Social Security online account, you need a Login.gov credential, an ID.me credential, or you must create one if you don’t already have one.",,,,,,,,,,,,
What types of compensation are considered wages subject to federal employment taxes?,"Wages subject to federal employment taxes include all pay given to an employee for services performed, such as salaries, vacation allowances, bonuses, commissions, taxable fringe benefits, signing or ratification bonuses, payments for cancellation of an employment contract, and compensation paid to former employees for work performed while still employed.",,,,,,,,,,,,
Are cash wages paid to farmworkers subject to social security and Medicare taxes?,"Yes, cash wages paid to farmworkers are generally subject to social security tax and Medicare tax.",,,,,,,,,,,,
Are farmwork employees generally subject to social security and Medicare taxes?,"Yes, employees for farmwork are generally subject to social security tax and Medicare tax.",,,,,,,,,,,,
What happens if you withhold less than the correct amount of tax from an employee's wages?,"If you withhold less than the correct tax from an employee's wages, you are still liable for the full amount of the tax to the federal government.",,,,,,,,,,,,
Is FUTA tax withheld from employees' wages or paid by employees?,"No, FUTA tax is not withheld by the employer or paid by the employee.",,,,,,,,,,,,
What types of compensation are discussed in Pub. 15-B?,"Pub. 15-B provides information on various forms of compensation, including accident and health benefits, achievement awards, adoption assistance, athletic facilities, de minimis (minimal) benefits, dependent care assistance, educational assistance, employee discounts, employee stock options, employer-provided cell phones, group-term life insurance coverage, health savings accounts, lodging on business premises, meals, no-additional-cost services, retirement planning services, transportation (commuting) benefits, tuition reduction, and working condition benefits.",,,,,,,,,,,,
Are noncash wages paid to farmworkers subject to federal taxes?,"Noncash wages, including commodity wages, paid to farmworkers are not subject to social security taxes, Medicare taxes, or federal income tax withholding. However, the employer and employee can agree to have federal income tax withheld on noncash wages.",,,,,,,,,,,,
How are noncash wages treated if the substance of the transaction is a cash payment?,"Noncash wages are treated as cash wages if the substance of the transaction is a cash payment. In such cases, they are subject to social security taxes, Medicare taxes, and federal income tax withholding, and their value should be reported in box 1 of Form W-2 (or box 7 of Form 499R-2/W-2PR) together with cash wages.",,,,,,,,,,,,
Are noncash wages for farmwork subject to federal income tax?,Noncash wages for farmwork are subject to federal income tax unless a specific exclusion applies.,,,,,,,,,,,,
Are social security and Medicare taxes required for payments made to share farmers under share-farming arrangements?,"No, you don't have to withhold or pay social security and Medicare taxes on amounts paid to share farmers under share-farming arrangements.",,,,,,,,,,,,
How should compensation of $600 or more paid to H-2A visa holders be reported?,Compensation of $600 or more paid to foreign H-2A visa holders should be reported.,,,,,,,,,,,,
Where should compensation of $600 or more paid to H-2A visa holders be reported on Form W-2?,"Compensation of $600 or more paid to H-2A visa holders should be reported in box 1 of Form W-2 (or box 7 of Form 499R-2/W-2PR), but it should not be reported as social security wages (box 3 of Form W-2 or box 20 of Form 499R-2/W-2PR) or Medicare wages (box 5 of Form W-2 or box 22 of Form 499R-2/W-2PR).",,,,,,,,,,,,
Are H-2A visa workers subject to social security and Medicare taxes?,"No, compensation paid to H-2A visa workers for agricultural labor performed in connection with this visa is not subject to social security and Medicare taxes.",,,,,,,,,,,,
