question,answer,input_tokens,output_tokens,total_tokens,response_time_seconds,p99_processing_time,p95_processing_time,avg_processing_time,page_count,avg_time_per_page,p99_time_per_page,p95_time_per_page,tokens_per_page
Are all wages subject to state unemployment tax also subject to FUTA tax?,"No, certain types of wages may be excluded from state unemployment tax but are still subject to FUTA tax, such as wages paid to corporate officers, certain sick pay by unions, and certain fringe benefits.",,,,,,,,,,,,
When are liabilities for credit reduction states required to be deposited?,"Liabilities for credit reduction states must be included with the fourth quarter deposit, although anticipated extra liability may be deposited throughout the year. These liabilities are recorded as being incurred in the fourth quarter.",,,,,,,,,,,,
When can a successor employer count wages paid by a previous employer toward the FUTA tax wage base?,A successor employer can count the wages paid by a previous employer if they acquired a business from an employer who was liable for FUTA tax and the employees continue to work for the successor employer.,,,,,,,,,,,,
How is FUTA tax liability calculated for deposit purposes?,FUTA tax liability is calculated quarterly by multiplying the amount of taxable wages paid during the quarter by 0.6%. This amount may need adjustments depending on the credit for state unemployment contributions.,,,,,,,,,,,,
What should be done if the FUTA tax liability for a quarter is $500 or less?,"If the FUTA tax liability for a quarter is $500 or less, you don't have to deposit the tax. Instead, you may carry it forward and add it to the liability for the next quarter to determine if a deposit is required.",,,,,,,,,,,,
When must you deposit FUTA tax if the liability for a calendar quarter is over $500?,You must deposit the tax by EFT by the last day of the first month that follows the end of the quarter.,,,,,,,,,,,,
Are you required to deposit FUTA taxes for household employees?,"No, you are not required to deposit FUTA taxes for household employees unless you report their wages on Forms 941, 943, or 944.",,,,,,,,,,,,
What are the options for paying FUTA tax if the liability for the fourth quarter is $500 or less?,"If the liability is $500 or less, you can make a deposit, pay the tax with a credit or debit card, or pay the tax with your Form 940 by January 31.",,,,,,,,,,,,
When is the due date to file Form 940 for the 2024 FUTA tax year?,"The due date to file Form 940 for the 2024 FUTA tax year is January 31, 2025. However, if all FUTA taxes were deposited on time, the form may be filed by February 10, 2025.",,,,,,,,,,,,
What are the options for paying FUTA taxes electronically?,"FUTA taxes can be paid electronically by e-filing Form 940 and using the Electronic Funds Withdrawal (EFW) option. For more information, visit IRS.gov/Payments.",,,,,,,,,,,,
How should FUTA tax for household employees be reported?,"FUTA tax for household employees should be reported on Schedule H (Form 1040) if employment taxes for these employees were not reported on Forms 941, 943, or 944. See Publication 926 for additional details.",,,,,,,,,,,,
What is required to file Schedule H (Form 1040)?,You must have an EIN to file Schedule H (Form 1040).,,,,,,,,,,,,
How can CPEOs request a waiver for the electronic filing requirement for Form 940?,"To request a waiver, the CPEO must file a written request using the IRS Online Registration System for Professional Employer Organizations at least 45 days before the due date of the return.",,,,,,,,,,,,
Where can more information on filing a waiver request electronically be found?,More information on filing a waiver request electronically can be found at IRS.gov/CPEO and in Revenue Procedure 2023-18.,,,,,,,,,,,,
What section of the Internal Revenue Code does the text reference for special rules regarding services and payments?,The text references section 15 of the Internal Revenue Code for special rules regarding services and payments.,,,,,,,,,,,,
What are the conditions under which agricultural labor wages are taxable for Social Security and Medicare taxes?,Agricultural labor wages are taxable for Social Security and Medicare taxes if they are subject to these taxes.,,,,,,,,,,,,
What tests determine if agricultural labor wages are taxable under FUTA?,"Agricultural labor wages are taxable under FUTA if the $150 test or $2,500 test in section 9 is met.",,,,,,,,,,,,
When are wages related to production and harvesting of turpentine and other oleoresinous products considered taxable?,"Wages are taxable if they are subject to social security tax and Medicare tax, if the $150 test or $2,500 test in section 9 is met, or if either test in section 14 is met.",,,,,,,,,,,,
Under what conditions are wages related to cotton ginning considered taxable?,"Wages are taxable if they are subject to social security tax and Medicare tax, if the $150 test or $2,500 test in section 9 is met, or if either test in section 14 is met.",,,,,,,,,,,,
What determines the taxability of wages for work in the hatching of poultry?,"Wages are taxable if they are subject to social security tax and Medicare tax, if the $150 test or $2,500 test in section 9 is met (not farmwork if performed off farm), or if either test in section 14 is met.",,,,,,,,,,,,
When are wages for farming purposes taxable under social security and Medicare tax?,"Wages for farming purposes are taxable under social security and Medicare tax if the $150 test or $2,500 test in section 9 is met, or if either test in section 14 is met.",,,,,,,,,,,,
What determines taxability for processing agricultural commodities in the employ of a farm operator?,"If the operator produced over half of the commodity processed, wages are taxable if the $150 test or $2,500 test in section 9 is met. If the operator did not produce over half, the wages are taxable as not being farmwork.",,,,,,,,,,,,
What is the taxability rule for employees of unincorporated groups of farm operators?,"Wages are taxable if subject to social security and Medicare tax. If the group produced all the commodity processed, wages are taxable if the $150 test or $2,500 test in section 9 is met. If the employer produced over half of the commodity, wages are taxable if either test in section 14 is met; otherwise, they are taxable as not being farmwork.",,,,,,,,,,,,
When are wages for handling or processing commodities after delivery to a terminal market considered taxable?,Wages for handling or processing commodities after delivery to a terminal market are considered taxable if they are subject to social security tax and Medicare tax.,,,,,,,,,,,,
How are services performed by resident aliens in the United States treated for tax purposes?,"Services performed by resident aliens in the United States are treated the same as those performed by U.S. citizens, except for exemptions if any part of the service as a crew member of a foreign vessel or aircraft is performed outside the United States.",,,,,,,,,,,,
Where are wages for services not considered farmwork reported?,Wages for services not considered farmwork are reported on Forms 941 or Form 944.,,,,,,,,,,,,
What conditions make service performed outside the United States taxable for employment taxes?,"Service performed outside the United States is taxable if the worker is working for an American employer or if an American employer, by agreement, covers U.S. citizens and residents employed by its foreign affiliates or subsidiaries.",,,,,,,,,,,,
"Are ""H-2A"" workers, who perform temporary agricultural labor, subject to employment taxes?","No, ""H-2A"" workers are exempt from Federal Income Tax Withholding, Social Security and Medicare taxes, and FUTA.",,,,,,,,,,,,
"Under what conditions are nonimmigrant aliens, such as students, scholars, and trainees, exempt from employment taxes?","Nonimmigrant aliens under section 101(a)(15)(F), (J), (M), or (Q) are exempt from employment taxes if their service is performed for purposes specified in those sections.",,,,,,,,,,,,
"Under what circumstances are taxes exempt for services performed by individuals under sections 101(a)(15)(F), (J), (M), or (Q) of the Immigration and Nationality Act?","Taxes are exempt if the service is performed for purposes specified in sections 101(a)(15)(F), (J), (M), or (Q) of the Immigration and Nationality Act. However, these taxes may apply if the employee becomes a resident alien.",,,,,,,,,,,,
Are taxes exempt for a Philippine resident admitted to Guam or CNMI under section 101(a)(15)(H)(ii) of the Immigration and Nationality Act?,"Taxes are exempt if the service is performed for purposes specified in section 101(a)(15)(H)(ii) of the Immigration and Nationality Act. However, these taxes may apply if the employee becomes a resident alien.",,,,,,,,,,,,
"What is the tax status for services performed in the CNMI by a Philippine resident not admitted under section 101(a)(15)(H)(ii) on or after January 1, 2015?","For services performed in the CNMI by a Philippine resident not admitted under section 101(a)(15)(H)(ii) on or after January 1, 2015, the services are taxable.",,,,,,,,,,,,
Under what circumstances are wages paid to a deceased worker's beneficiary or estate taxable?,Wages paid to a deceased worker's beneficiary or estate are taxable if they are paid in the same calendar year as the worker's death.,,,,,,,,,,,,
How are cafeteria plan benefits under section 125 taxed?,"If an employee chooses cash or another taxable benefit, the benefits are subject to all employment taxes. If the employee chooses a nontaxable benefit, it is treated the same as if the benefit was provided outside the plan.",,,,,,,,,,,,
When is a nonresident working on an American vessel or aircraft outside the United States subject to taxation?,A nonresident is taxable if they are under a contract made in the United States or if they are employed on a vessel or aircraft that touches a U.S. port.,,,,,,,,,,,,
What is the tax treatment for dependent care assistance programs under section 129?,Dependent care assistance programs are exempt to the extent it is reasonable to believe amounts are excludable from gross income under section 129.,,,,,,,,,,,,
Are wages paid to a disabled worker after the year they became entitled to Social Security disability insurance benefits taxable?,Wages paid to a disabled worker after the year they became entitled to Social Security disability insurance benefits are exempt if the worker did not perform any service for the employer during the period for which the payment is made.,,,,,,,,,,,,
Which territories are included in the definition of the United States according to the text?,"The United States includes American Samoa, Guam, the CNMI (Commonwealth of the Northern Mariana Islands), the USVI (U.S. Virgin Islands), and Puerto Rico.",,,,,,,,,,,,
What is the tax treatment for amounts under an accountable plan that do not exceed the specified government rate for per diem or standard mileage?,"Amounts not exceeding the specified government rate for per diem or standard mileage under an accountable plan are exempt from withholding, taxability, and reporting.",,,,,,,,,,,,
At what age is a child employed by a parent exempt from taxes under the family employees category?,"A child employed by a parent is exempt from taxes until age 18, or until age 21 for domestic service.",,,,,,,,,,,,
When are fishing-related activities taxable in connection with catching or farming aquatic life?,"Fishing-related activities are taxable unless an arrangement with the boat owner or operator (as specified in condition 3) applies. For aquatic life other than salmon or halibut, activities are exempt only if the vessel is less than 10 net tons and condition 3 does not apply.",,,,,,,,,,,,
What arrangement allows an individual to receive a share of a boat's catch or its proceeds?,"An individual can receive a share of the boat's catch (or the proceeds from the sale of the catch) if the arrangement is based on the boat's catch, and the operating crew of the boat normally consists of fewer than 10 individuals.",,,,,,,,,,,,
Under what conditions is cash remuneration for crew members on a boat exempt?,"Cash remuneration is exempt if it is (a) $100 or less, (b) contingent on a minimum catch, and (c) paid solely for additional duties such as those of a mate, engineer, or cook where cash remuneration is traditional.",,,,,,,,,,,,
When is foreign service by U.S. citizens exempt or not exempt from withholding?,"Foreign service by U.S. citizens is exempt if they work for foreign affiliates of American employers and either (1) are reasonably believed to qualify for income exclusion under section 911, or (2) their employer is required by the foreign country's law to withhold income tax. Withholding applies if the U.S. citizen works as a U.S. Government employee, with the same rules as within the United States.",,,,,,,,,,,,
Under what conditions is a U.S. citizen working for an American employer exempt from employment taxes?,"A U.S. citizen working for an American employer is exempt from employment taxes unless they are (1) working on an American vessel or aircraft under a contract made in the United States or employed on a vessel when it touches a U.S. port, or (2) working in a contiguous country with which the United States has an unemployment compensation agreement or in the U.S. Virgin Islands (USVI).",,,,,,,,,,,,
Are income derived by Native Americans exercising fishing rights subject to employment taxes?,"No, income derived by Native Americans exercising fishing rights is generally exempt from employment taxes.",,,,,,,,,,,,
How are fringe benefits treated for employment tax purposes?,"Fringe benefits are taxable on the excess of the fair market value of the benefit over the sum of the amount paid for it by the employee and any amount excludable by law. However, special valuation rules may apply, and benefits provided under cafeteria plans may qualify for exclusion from wages for social security, Medicare, and FUTA taxes.",,,,,,,,,,,,
"When can cafeteria plans qualify for exclusion from wages for Social Security, Medicare, and FUTA taxes?","Cafeteria plans may qualify for exclusion from wages for Social Security, Medicare, and FUTA taxes. For details, see Pub. 15-B.",,,,,,,,,,,,
Under what conditions are government employees' wages subject to Social Security and Medicare taxes?,"Government employees' wages are generally subject to Social Security and Medicare taxes if they perform services while either (a) covered under a section 218 agreement or (b) not covered under a section 218 agreement and not a member of a public retirement system (mandatory Social Security and Medicare coverage). Additionally, Medicare tax applies to services performed by employees hired or rehired after March 31, 1986, who aren't covered under a section 218 agreement or the mandatory Social Security provisions, unless specifically excluded by law.",,,,,,,,,,,,
Are election workers' wages taxable for Social Security and Medicare purposes?,"Election workers' wages are taxable if they are paid $2,400 or more in 2025 (or a lesser amount if specified by a section 218 Social Security agreement). However, a Form W-2 must be filed for payments of $600 or more, even if no Social Security or Medicare taxes apply.",,,,,,,,,,,,
"When must Form W-2 be filed for payments, even if no social security or Medicare taxes were withheld?","Form W-2 must be filed for payments of $600 or more, even if no social security or Medicare taxes were withheld.",,,,,,,,,,,,
"Are emergency workers hired temporarily in response to unforeseen emergencies exempt from withholding, and under what circumstances?","Yes, emergency workers hired temporarily in response to unforeseen emergencies (such as fire, storm, snow, earthquake, or flood) are exempt from withholding if they are serving on a temporary basis.",,,,,,,,,,,,
What are the social security and Medicare tax rules for U.S. federal government employees?,U.S. federal government employees are taxable for Medicare and taxable for social security unless they were hired before 1984. An exemption applies if the worker is a seaman performing services on or in connection with an American vessel owned or chartered by the United States and operated by the general agent of the Secretary of Commerce.,,,,,,,,,,,,
What are the conditions under which household employees' wages are taxable for Social Security and Medicare in 2025?,"Household employees' wages are taxable for Social Security and Medicare if the employer paid $2,800 or more in cash in 2025. However, they are exempt if the employee is under age 18 during any part of the calendar year and the job is not the employee's principal occupation.",,,,,,,,,,,,
"When are wages for domestic service in college clubs, fraternities, and sororities exempt from taxation?","Wages for domestic service in college clubs, fraternities, and sororities are exempt if paid to a regular student or if the employee is paid less than $100 in a year by an income-tax-exempt employer.",,,,,,,,,,,,
What is the FUTA taxation rule for household employees?,"FUTA applies to household employees if the employer paid total cash wages of $1,000 or more in any quarter in the current or preceding calendar year.",,,,,,,,,,,,
What types of insurance premiums for employees are generally exempt from taxation?,"Accident and health insurance premiums under a plan or system for employees and their dependents are generally exempt, except for 2% shareholder-employees of S corporations. Group-term life insurance costs are exempt, except for the cost includible in the employee's gross income, with special rules applying for former employees.",,,,,,,,,,,,
When is income for full-time life insurance salespeople considered taxable?,Income for full-time life insurance salespeople is taxable if they are employees under common law and not paid solely by commissions.,,,,,,,,,,,,
Are amounts paid to employees under a leave-sharing plan taxable?,"Yes, amounts paid to employees under a leave-sharing plan are taxable and subject to withholding.",,,,,,,,,,,,
What is the tax treatment for newspaper and magazine vendors under age 18?,Newspaper carriers under age 18 and newspaper and magazine vendors buying at fixed prices and retaining receipts from sales to customers are exempt.,,,,,,,,,,,,
"How are noncash payments for household work, agricultural labor, and service outside the employer’s trade or business treated?","Noncash payments for household work, agricultural labor, and service not in the course of the employer's trade or business are exempt if both the employer and employee voluntarily agree.",,,,,,,,,,,,
How should distributions and payments to officers or shareholders of an S corporation be treated?,Distributions and other payments to officers or shareholders of an S corporation must be treated as wages to the extent the amounts are reasonable compensation for services to the corporation by an employee.,,,,,,,,,,,,
What is the tax treatment for payments to general or limited partners of a partnership under employment taxes?,"Payments to general or limited partners of a partnership are exempt from federal income tax withholding, Social Security and Medicare taxes, and FUTA taxes.",,,,,,,,,,,,
How are employer contributions to qualified retirement plans treated under employment taxes?,"Employer contributions to a qualified retirement plan are exempt from federal income tax withholding, Social Security and Medicare taxes, and FUTA taxes.",,,,,,,,,,,,
Are employee salary reduction contributions to a 401(k) plan taxable under employment taxes?,Employee salary reduction contributions to a 401(k) plan are generally exempt from federal income tax withholding but are taxable for Social Security and Medicare taxes.,,,,,,,,,,,,
What is the tax treatment of employee salary reduction contributions to a SIMPLE retirement account?,Employee salary reduction contributions to a SIMPLE retirement account are exempt from withholding but are taxable.,,,,,,,,,,,,
"What are the withholding rules for distributions from qualified retirement and pension plans, including section 403(b) annuities?","Withholding applies, but the recipient may elect an exemption on Form W-4P in certain cases. Mandatory 20% withholding applies to an eligible rollover distribution that isn't a direct rollover, while direct rollovers are exempt.",,,,,,,,,,,,
"How are statutory nonemployees, like qualified real estate agents and direct sellers, treated for tax withholding and taxability?",Statutory nonemployees are exempt from withholding and are not taxable.,,,,,,,,,,,,
When is severance or dismissal pay considered taxable according to the text?,Severance or dismissal pay is always taxable.,,,,,,,,,,,,
Under what conditions is service not in the course of the employer's trade or business taxable?,Service not in the course of the employer's trade or business is taxable if the employee receives $100 or more in cash in a calendar year and only taxable if the employee earns $50 or more in cash in a quarter and works on 24 or more different days in that quarter or the preceding quarter.,,,,,,,,,,,,
When is sick pay exempt from withholding?,Sick pay is exempt from withholding after the end of six calendar months following the calendar month the employee last worked for the employer.,,,,,,,,,,,,
"What is the tax treatment for students, scholars, trainees, or teachers employed by an auxiliary nonprofit organization controlled by a school, college, or university?","For students, scholars, trainees, or teachers employed by an auxiliary nonprofit organization, federal income tax withholding applies, Social Security and Medicare taxes are exempt unless services are covered by a section 218 (Social Security Act) agreement, and FUTA is exempt.",,,,,,,,,,,,
How are full-time students performing services for academic credit treated under federal income tax withholding and employment taxes?,"For full-time students performing services for academic credit, federal income tax withholding applies, Social Security and Medicare taxes are taxable unless the program was established for or on behalf of an employer or group of employers, and FUTA is exempt.",,,,,,,,,,,,
What is the employment tax treatment for student nurses performing part-time services at a hospital as part of their training?,"For student nurses performing part-time services at a hospital as part of their training, federal income tax withholding applies, and both Social Security and Medicare taxes and FUTA are exempt.",,,,,,,,,,,,
"What is the tax withholding rule for nonimmigrant aliens holding F-1, J-1, M-1, or Q-1 visas under section 101(a)(15) of the Immigration and Nationality Act?","Taxes are withheld unless excepted by regulations. The service is exempt if performed for purposes specified in section 101(a)(15)(F), (J), (M), or (Q) of the Immigration and Nationality Act, but taxes may apply if the employee becomes a resident alien.",,,,,,,,,,,,
"Are tips taxable and subject to withholding, and how does the $20 threshold affect this?",Tips of $20 or more in a month are taxable and subject to withholding for all tips reported in writing to the employer. Tips under $20 in a month are exempt.,,,,,,,,,,,,
What is the taxation rule for employees of territorial governments like Guam or the CNMI?,"For Guam, employees are exempt, except for certain temporary and intermittent employees. For the CNMI, employees are exempt, but taxable beginning in the fourth calendar quarter of 2012.",,,,,,,,,,,,
What happens if an employer outsources payroll and tax duties to a third-party payer?,"If an employer outsources payroll and related tax duties (such as withholding, reporting, and paying social security, Medicare, FUTA, and income taxes) to a third-party payer, the employer generally remains responsible for those duties, including liability for the taxes.",,,,,,,,,,,,
Who is responsible for federal tax deposits and payments when an employer uses a third-party payer?,"The employer remains responsible for federal tax deposits and other federal tax payments, even if they forward the tax amounts to the third-party payer to make the deposits and payments.",,,,,,,,,,,,
Is there any exception to an employer's responsibility when using a third-party payer?,"Yes, there is an exception involving a Certified Professional Employer Organization (CPEO), which is discussed later in the section.",,,,,,,,,,,,
What happens if a third party fails to make the required tax deposits and payments?,"If a third party fails to make the required tax deposits and payments, the IRS may assess penalties and interest on the employer’s account, and the employer may be liable for all taxes, penalties, and interest due. The employer may also be held personally liable for certain unpaid federal taxes.",,,,,,,,,,,,
Why is it important for employers to maintain their address as the address of record with the IRS?,It is important for employers to maintain their address as the address of record with the IRS because correspondence about tax matters involving the employer’s business is sent to this address. Using the address of a third-party payer may significantly limit the employer’s ability to stay informed about these matters.,,,,,,,,,,,,
What should an employer do when a third party enrolls them in EFTPS for federal tax deposits?,"When a third party enrolls an employer in EFTPS for federal tax deposits, the employer should activate and use the Inquiry PIN they receive to monitor their account and ensure the third party is making the required tax deposits.",,,,,,,,,,,,
