question,answer,input_tokens,output_tokens,total_tokens,response_time_seconds,p99_processing_time,p95_processing_time,avg_processing_time,page_count,avg_time_per_page,p99_time_per_page,p95_time_per_page,tokens_per_page
How should an employee who was paid wages in 2019 and submitted an invalid Form W-4 in 2025 be treated?,An employee who was paid wages in 2019 and submits an invalid Form W-4 in 2025 should continue to be treated as single and claiming zero allowances on a 2019 Form W-4.,,,,,,,,,,,,
What is the optional computational bridge approach for withholding in 2025?,"Using the optional computational bridge, an employee can be treated as if they had checked the box for Single or Married filing separately in Step 1(c), made no entries in Steps 2 and 3, entered $8,600 in Step 4(a), and entered zero in Step 4(b) of the 2025 Form W-4.",,,,,,,,,,,,
What resource can be used to determine the amount exempt from levy when withholding amounts?,Pub. 1494 has tables to figure the amount exempt from levy.,,,,,,,,,,,,
"What is the Federal Insurance Contributions Act (FICA) designed to provide, and how is it funded?","FICA provides a federal system of old-age, survivors, disability, and hospital insurance. The old-age, survivors, and disability insurance part is funded by the social security tax, while the hospital insurance part is funded by the Medicare tax.",,,,,,,,,,,,
Are all wages subject to social security and Medicare taxes?,"No, certain types of wages and compensation aren't subject to social security and Medicare taxes.",,,,,,,,,,,,
Are all employee wages subject to Social Security and Medicare taxes?,"Generally, employee wages are subject to Social Security and Medicare taxes regardless of the employee's age or whether they are receiving Social Security benefits.",,,,,,,,,,,,
"What are the conditions under which farmwork wages are subject to Social Security, Medicare taxes, and federal income tax withholding?","Farmwork wages are subject to these taxes if either of the following tests is met: (1) you pay cash wages of $150 or more in a year to an individual farmworker, or (2) the total cash and non-cash wages you pay to all farmworkers during the year is $2,500 or more.",,,,,,,,,,,,
Are seasonal farmworkers’ wages under $150 subject to Social Security and Medicare taxes?,"No, annual cash wages of less than $150 paid to a seasonal farmworker are not subject to Social Security and Medicare taxes.",,,,,,,,,,,,
When are seasonal farmworkers' wages exempt from Social Security and Medicare taxes?,"Seasonal farmworkers' wages are exempt from Social Security and Medicare taxes if they receive annual cash wages of less than $150, even if the total wages paid to all farmworkers exceed $2,500.",,,,,,,,,,,,
What conditions define a seasonal farmworker under this rule?,"A seasonal farmworker is defined as someone who is employed in agriculture as a hand-harvest laborer, is paid piece rates in an operation typically paid on a piece-rate basis in the region, commutes daily from their permanent home to the farm, and had been employed in agriculture for less than 13 weeks in the preceding calendar year.",,,,,,,,,,,,
Are wages paid to a child under 18 working on a family farm subject to Social Security and Medicare taxes?,"No, wages paid to a child under 18 working on a farm that is a sole proprietorship or a partnership in which each partner is a parent of the child are not subject to Social Security and Medicare taxes. However, these wages count toward the $2,500 test for determining whether other farmworkers' wages are subject to these taxes.",,,,,,,,,,,,
What are the tax rates for social security and Medicare in 2025?,"For 2025, the social security tax rate is 6.2% for both the employer and employee (12.4% total). The Medicare tax rate is 1.45% for both the employer and employee (2.9% total).",,,,,,,,,,,,
"What is the social security wage base limit in 2025, and does Medicare have a wage base limit?","The social security wage base limit in 2025 is $176,100. Medicare does not have a wage base limit; all covered wages are subject to Medicare tax.",,,,,,,,,,,,
When should an employer deduct social security and Medicare taxes for farmworkers?,"An employer may deduct the tax either when making wage payments or after the $2,500 test or the $150 test has been met if unsure whether the wages will be taxable during the year.",,,,,,,,,,,,
When is the 0.9% Additional Medicare Tax required to be withheld from an employee's wages?,"The 0.9% Additional Medicare Tax must be withheld from an employee's wages when they exceed $200,000 in a calendar year. Withholding begins in the pay period in which the wages exceed $200,000 and continues until the end of the calendar year.",,,,,,,,,,,,
Is the employer required to pay a share of the Additional Medicare Tax?,"No, the Additional Medicare Tax is only imposed on the employee, and there is no employer share of this tax.",,,,,,,,,,,,
Are all wages subject to the Additional Medicare Tax withholding?,"All wages subject to Medicare tax are also subject to the Additional Medicare Tax withholding if they exceed the $200,000 threshold in a calendar year.",,,,,,,,,,,,
What should you do to determine if Schedule D (Form 941) needs to be filed?,You should determine whether or not to file Schedule D (Form 941) by reviewing the Instructions for Schedule D (Form 941).,,,,,,,,,,,,
How are wages subject to Social Security and Medicare tax calculated when acquiring a business with employees?,"Wages paid to an employee are subject to Social Security tax on the first $174,100 ($176,100 minus $2,000 in wages paid by the previous employer) and Medicare tax on all wages paid during the calendar year.",,,,,,,,,,,,
How is the Additional Medicare Tax withholding threshold applied when acquiring an employee from a purchased business?,"You should include the $2,000 wages the employee received from the previous employer in determining whether the employee’s wages exceed the $200,000 Additional Medicare Tax withholding threshold.",,,,,,,,,,,,
What happens if an employer pays an employee's social security and Medicare taxes without deducting them from the employee's pay?,"If an employer pays an employee's social security and Medicare taxes without deducting them from the employee's pay, the payments must be included in the employee's wages for social security and Medicare taxes, which increases the employee's wage payment and is also subject to additional social security and Medicare taxes.",,,,,,,,,,,,
Can household and agricultural employers choose to pay their employees' social security and Medicare taxes without withholding them from wages?,"Yes, household and agricultural employers can choose to pay their employees' social security and Medicare taxes without withholding them from wages, but they are still required to pay the taxes on behalf of the employee.",,,,,,,,,,,,
Where can employers find additional guidance on paying employee social security and Medicare taxes?,"Employers can find additional guidance on paying employee social security and Medicare taxes in Revenue Ruling 86-14, 1986-1 C.B. 304, and Publication 15-A.",,,,,,,,,,,,
Where should an employer include employee social security and Medicare taxes paid on behalf of the employee when preparing Form W-2?,"The employer should include the employee's share of social security and Medicare taxes paid on their behalf in box 1 of the employee's Form W-2 (or box 7 of Form 499R-2/W-2PR), but not in boxes 3 and 5 (or boxes 20 and 22 of Form 499R-2/W-2PR).",,,,,,,,,,,,
Should the additional income from employer-paid social security and Medicare taxes be counted as wages for FUTA tax purposes?,"No, the additional income from employer-paid social security and Medicare taxes should not be counted as wages for FUTA tax purposes.",,,,,,,,,,,,
What example is provided to illustrate employer-paid social security and Medicare taxes?,"The example is about Gavrielle, who operates a small family fruit farm and employs day laborers during the picking season. Gavrielle pays the employees' share of social security and Medicare taxes on their behalf and includes it in box 1 of their Form W-2 as wage income but excludes it from social security and Medicare wages.",,,,,,,,,,,,
How does Gavrielle report the wages and taxes paid to Dan on his Form W-2 for 2025?,"Gavrielle enters $1,076.50 in box 1 of Dan's Form W-2, which includes $1,000 in wages and $76.50 for social security and Medicare taxes paid for Dan. She also enters $1,000 in boxes 3 and 5 of Dan's Form W-2.",,,,,,,,,,,,
Do social security and Medicare taxes apply to sick pay payments?,"Yes, social security and Medicare taxes apply to most payments of sick pay, including those made by third parties such as insurance companies.",,,,,,,,,,,,
What are the social security and FUTA tax wage bases for motion picture project workers in 2025?,"For 2025, the social security tax wage base is $176,100, and the FUTA tax wage base is $7,000 for motion picture project workers.",,,,,,,,,,,,
Where can one find the definition of a motion picture project employer and worker?,The definition of a motion picture project employer and worker can be found in section 3512.,,,,,,,,,,,,
Are foreign agricultural workers on H-2A visas subject to social security and Medicare taxes?,"No, foreign agricultural workers on H-2A visas are exempt from social security and Medicare taxes.",,,,,,,,,,,,
What is the purpose of international social security agreements mentioned in the text?,"International social security agreements, also known as totalization agreements, eliminate dual social security coverage and taxation, and compensation subject to these taxes may be exempt under such agreements.",,,,,,,,,,,,
Who qualifies for a Medicare tax exemption based on religious beliefs?,"Members of a recognized religious sect opposed to insurance qualify for a Medicare tax exemption, but only if both the employee and the employer are members of the sect.",,,,,,,,,,,,
When is a foreign person treated as an American employer for FICA tax purposes?,A foreign person is treated as an American employer for FICA tax purposes if they are a member of a domestically controlled group of entities and their employee performs services related to a contract between the U.S. Government (or its instrumentality) and any member of the group.,,,,,,,,,,,,
How are part-time workers treated for tax purposes?,"Part-time workers and workers hired for short periods of time are treated the same as full-time employees for federal income tax withholding, Social Security, Medicare, and FUTA tax purposes.",,,,,,,,,,,,
How is income tax withholding calculated for part-time or short-term workers?,Income tax withholding for part-time or short-term workers may be figured the same way as for full-time workers or by using the part-year employment method explained in section 6 of Pub. 15-T.,,,,,,,,,,,,
Are employers required to notify employees about the Earned Income Credit (EIC)?,"Yes, employers must notify employees, except for those in American Samoa, Guam, Puerto Rico, the CNMI, and the USVI, who have no federal income tax withheld, that they may be able to claim a tax refund because of the EIC.",,,,,,,,,,,,
Does it matter if a part-time or short-term worker has another job or has reached the maximum amount of Social Security tax with another employer?,"Generally, it does not matter if a part-time or short-term worker has another job or has reached the maximum amount of Social Security tax with another employer, except in cases involving a successor employer.",,,,,,,,,,,,
Who should be notified about the Earned Income Credit (EIC) for 2024?,"Employees whose wages for 2024 were less than $59,899 ($66,819 if married filing jointly) should be notified that they may be eligible to claim the EIC.",,,,,,,,,,,,
How can employers meet the notification requirement for the EIC?,"Employers can meet the notification requirement by issuing Form W-2 with the EIC notice on the back of Copy B, providing a substitute Form W-2 with the same statement, or giving Notice 797 or their own statement with the same wording.",,,,,,,,,,,,
What should be done if a substitute Form W-2 does not include the required EIC statement?,"If a substitute Form W-2 does not include the required EIC statement, the employer must notify the employee within 1 week of the date the substitute was given.",,,,,,,,,,,,
What must an employer provide to an employee if Form W-2 is not given on time?,"If Form W-2 is not given on time, the employer must provide the employee with Notice 797 or a written statement by the date Form W-2 is required to be given.",,,,,,,,,,,,
What is the deadline to notify an employee if Form W-2 is not required?,"If Form W-2 is not required, the employer must notify the employee by February 7, 2025.",,,,,,,,,,,,
Under what conditions can an employer make a tax payment with a timely filed return instead of depositing?,An employer can make a tax payment with a timely filed return instead of depositing if:,,,,,,,,,,,,
When should you use the semiweekly or monthly deposit rules to avoid an FTD penalty?,"You should use the semiweekly or monthly deposit rules if you're unsure that your total tax liability for the current quarter will be less than $2,500 and your liability for the prior quarter wasn't less than $2,500.",,,,,,,,,,,,
What is the condition for not being subject to an FTD penalty for Form 943 total tax liability?,"You won't be subject to an FTD penalty if your Form 943 total tax liability for the year (line 13) is less than $2,500. However, if you're unsure it will be less than $2,500, you should deposit under the explained rules.",,,,,,,,,,,,
What conditions allow you to avoid an FTD penalty for Form 944 total tax liability?,"You can avoid an FTD penalty if your Form 944 total tax liability for the year (line 9) is less than $2,500, or if your liability is $2,500 or more and you have already deposited taxes owed for the first three quarters, your net tax for the fourth quarter is less than $2,500, and you pay the tax you owe for the fourth quarter in full with a timely filed return.",,,,,,,,,,,,
What is the condition under which you are not required to make deposits for Form 945 tax liabilities during the year?,"If the total amount of tax for the year reported on Form 945 is less than $2,500, you are not required to make deposits during the year.",,,,,,,,,,,,
"What should you do if you're unsure whether your Form 945 total tax liability will be less than $2,500?","If you're unsure that your Form 945 total tax liability will be less than $2,500, you should deposit under the rules explained in the section to avoid being subject to an FTD penalty.",,,,,,,,,,,,
What is the rule about combining deposits for payroll and nonpayroll tax liabilities?,"You must not combine deposits for Forms 941 (or Form 943 or Form 944) and Form 945 tax liabilities, as separate deposits are required for nonpayroll and payroll income tax withholding.",,,,,,,,,,,,
How should employment taxes for farmworkers and nonfarm workers be treated?,Employment taxes for farmworkers (Form 943 taxes) must be treated separately from employment taxes for nonfarm workers (Form 941/944 taxes). These taxes are not combined for applying deposit schedule rules and require separate deposits.,,,,,,,,,,,,
What is an example of separate deposits for Form 941/944 and Form 943 taxes?,"If you're a monthly schedule depositor and your tax liability at the end of April is $1,500 for Form 941/944 and $1,200 for Form 943, you must deposit both amounts by May 15 using separate transactions—one for the $1,500 and another for the $1,200.",,,,,,,,,,,,
What determines when deposits for employment taxes are due?,The two deposit schedules—monthly and semi-weekly—determine when deposits are due based on the dates payments were made or wages were paid.,,,,,,,,,,,,
How is the deposit schedule determined for a calendar year?,"The deposit schedule is determined based on the total tax liability reported on Forms 941, line 12; Form 943, line 13; Form 944, line 9; or Form 945, line 3, during a lookback period.",,,,,,,,,,,,
Does the frequency of employee payments or deposits affect the deposit schedule?,"No, the deposit schedule is not determined by how often you pay your employees or make deposits.",,,,,,,,,,,,
Do the deposit schedule rules apply to FUTA tax?,"No, the deposit schedule rules do not apply to FUTA tax. Information on depositing FUTA tax can be found in section 14.",,,,,,,,,,,,
How is the deposit schedule determined for Form 941 filers?,"For Form 941 filers, the deposit schedule for a calendar year is determined based on the total taxes reported on Forms 941, line 12, during a 4-quarter lookback period. If $50,000 or less is reported, the filer is a monthly schedule depositor; if more than $50,000 is reported, the filer is a semiweekly schedule depositor.",,,,,,,,,,,,
What is the lookback period for a Form 941 filer for calendar year 2025?,"The lookback period for a Form 941 filer for calendar year 2025 begins on July 1, 2023, and ends on June 30, 2024, covering the four quarters from July 1, 2023, through June 30, 2024.",,,,,,,,,,,,
How is the deposit schedule determined for Form 943 or Form 944 filers?,"For Form 943 or Form 944 filers, the deposit schedule for a calendar year is determined based on the total taxes reported during the second preceding calendar year, either on Forms 941 for all four quarters, Form 943, or Form 944 for that year.",,,,,,,,,,,,
What is the lookback period for Form 943 and Form 944 filers for 2025?,The lookback period for 2025 for a Form 943 or Form 944 filer is calendar year 2023.,,,,,,,,,,,,
How is the deposit schedule determined for Form 945 filers?,The deposit schedule for Form 945 filers for a calendar year is determined from the total taxes reported on line 3 of Form 945 for the second preceding calendar year.,,,,,,,,,,,,
"How is the total tax liability for the lookback period calculated for Forms 941, 943, and 944?","The total tax liability for the lookback period is determined based on the amount of taxes reported on Forms 941, line 12; Form 943, line 13; or Form 944, line 9, without reductions for the refundable portion of the credit for qualified sick and family leave wages.",,,,,,,,,,,,
How do adjustments made on forms like 941-X or 943-X affect the lookback rule?,"Adjustments made on forms like 941-X, 943-X, 944-X, and 945-X do not affect the amount of tax liability for previous periods for purposes of the lookback rule.",,,,,,,,,,,,
What determines whether an employer is a monthly schedule depositor for 2025?,"An employer is a monthly schedule depositor for 2025 if the lookback period tax liabilities, based on the amounts originally reported (not adjusted), were $50,000 or less.",,,,,,,,,,,,
What is the deposit period for monthly and semiweekly schedule depositors?,"For monthly schedule depositors, the deposit period is a calendar month. For semiweekly schedule depositors, the deposit periods are Wednesday through Friday and Saturday through Tuesday.",,,,,,,,,,,,
What determines whether you are a monthly schedule depositor for Form 941 filers?,"You are a monthly schedule depositor for Form 941 filers if the total taxes on Forms 941, line 12, for the 4 quarters in your lookback period were $50,000 or less.",,,,,,,,,,,,
When are employment taxes due under the monthly deposit schedule?,"Under the monthly deposit schedule, employment taxes on payments made during a month are due by the 15th day of the following month.",,,,,,,,,,,,
How do deposit rules apply to agents with an approved Form 2678?,"For agents with an approved Form 2678, the deposit rules apply based on the total employment taxes accumulated by the agent for their own employees and on behalf of all employers for whom they are authorized to act.",,,,,,,,,,,,
What is the deposit schedule for new employers filing Form 941?,"New employers filing Form 941 are considered monthly schedule depositors for the first calendar year of their business, as their tax liability in the lookback period before starting or acquiring the business is considered to be zero.",,,,,,,,,,,,
When does a filer become a semiweekly schedule depositor for Form 941?,"A filer becomes a semiweekly schedule depositor for Form 941 if the total taxes on Form 941, line 12, during their lookback period were more than $50,000.",,,,,,,,,,,,
"How does the lookback period affect new employers filing Forms 943, 944, or 945?","For new employers filing Forms 943, 944, or 945, their tax liability in the lookback period before starting or acquiring their business is considered to be zero, making them monthly schedule depositors for the first and second calendar years of their business.",,,,,,,,,,,,
When does a filer become a semiweekly schedule depositor?,"A filer becomes a semiweekly schedule depositor for a calendar year if the total taxes on Form 943 (line 13), Form 944 (line 9), or Form 945 (line 3) during their lookback period were more than $50,000.",,,,,,,,,,,,
What are the deposit deadlines for employment taxes under the semiweekly deposit schedule?,"For payments made on Wednesday, Thursday, and/or Friday, taxes must be deposited by the following Wednesday. For payments made on Saturday, Sunday, Monday, and/or Tuesday, taxes must be deposited by the following Friday.",,,,,,,,,,,,
What forms must semiweekly schedule depositors file along with their returns?,"Semiweekly schedule depositors must complete Schedule B (Form 941) and submit it with Form 941. If filing Form 943, they must complete Form 943-A. If filing Form 944 or Form 945, they must complete Form 945-A.",,,,,,,,,,,,
What form should a semiweekly schedule depositor complete and submit with their return?,"A semiweekly schedule depositor should complete Form 945-A, Annual Record of Federal Tax Liability, and submit it with their return.",,,,,,,,,,,,
"When are taxes due for paydays that fall on Wednesday, Thursday, or Friday?","Taxes for paydays that fall on Wednesday, Thursday, or Friday are due by the following Wednesday.",,,,,,,,,,,,
What is required if pay dates during a semiweekly period span two calendar quarters?,"If pay dates during a semiweekly period span two calendar quarters, separate deposits must be made for the separate liabilities. For example, if there is a pay date on Saturday, March 29, 2025 (first quarter), and another on Tuesday, April 1, 2025 (second quarter), two separate deposits would be required, both due on Friday, April 4, 2025.",,,,,,,,,,,,
When are separate deposits required for payroll tax liabilities?,"Separate deposits are required when there is more than one pay date during a semiweekly period and the pay dates fall in different return periods. For example, if a return period ends on Thursday, taxes accumulated on Wednesday and Thursday are subject to one deposit obligation, while taxes accumulated on Friday are subject to a separate obligation.",,,,,,,,,,,,
How do you determine if you are a monthly or semiweekly schedule depositor?,"To determine your deposit schedule, identify your lookback period and add the total taxes reported on specific forms (Form 941, line 12; Form 943, line 13; Form 944, line 9; or Form 945, line 3) during that period. If the total taxes reported were $50,000 or less, you are a monthly schedule depositor. If they were more than $50,000, you are a semiweekly schedule depositor.",,,,,,,,,,,,
What is an example of a lookback period for determining a deposit schedule?,"An example of a lookback period involves reporting Form 941 taxes. For the 2024 lookback period, taxes reported include $12,000 in the 3rd quarter of 2022 and $12,000 in the 4th quarter of 2022. For the 2025 lookback period, taxes reported include $12,000 in the 3rd quarter of 2023.",,,,,,,,,,,,
Why is Rose Co. a monthly schedule depositor in 2024 but a semiweekly schedule depositor in 2025?,"Rose Co. is a monthly schedule depositor in 2024 because its tax liability during the 2024 lookback period (third quarter 2022 through second quarter 2023) was $48,000, which is not more than $50,000. However, it becomes a semiweekly schedule depositor in 2025 because its tax liability during the 2025 lookback period (third quarter 2023 through second quarter 2024) increased to $51,000, exceeding the $50,000 threshold.",,,,,,,,,,,,
What is the significance of Red Co.'s reported taxes on its 2023 and 2024 Forms 943 in determining its depositor status?,"Red Co. is a monthly schedule depositor for 2025 because its tax liability for the 2023 lookback period ($48,000 reported on the 2023 Form 943) did not exceed $50,000. However, for 2026, Red Co. becomes a semiweekly schedule depositor because its tax liability for the 2024 lookback period ($60,000 reported on the 2024 Form 943) exceeded $50,000.",,,,,,,,,,,,
What is the threshold for determining whether a company is a monthly or semiweekly schedule depositor?,"The threshold for determining depositor status is $50,000. If a company’s total tax liability during the lookback period is more than $50,000, it is classified as a semiweekly schedule depositor; otherwise, it is a monthly schedule depositor.",,,,,,,,,,,,
What is the threshold amount for the lookback period for the calendar year 2024?,"The threshold amount for the lookback period for the calendar year 2024 is $60,000.",,,,,,,,,,,,
When is a deposit considered timely if the due date falls on a non-business day?,A deposit is considered timely if it is made by the close of the next business day when the original due date falls on a non-business day.,,,,,,,,,,,,
